//------------------------------------------------------------
Fecha : 22/09/2015 16:36 
Error : You have an error in your SQL syntax; check the manual that corresponds to your MySQL server version for the right syntax to use near ''192.168.2.203')' at line 1
SQL   : INSERT INTO PDV_C_TAQUILLA(ID_TERMINAL, ID_TAQUILLA, IP) VALUES('OAX',,'192.168.2.203');
//------------------------------------------------------------
//------------------------------------------------------------
Fecha : 22/09/2015 16:36 
Error : You have an error in your SQL syntax; check the manual that corresponds to your MySQL server version for the right syntax to use near '' at line 1
SQL   : SELECT IMP_BOLETO FROM PDV_C_TAQUILLA WHERE ID_TERMINAL = 'OAX' AND IP = '192.168.2.203' AND ID_TAQUILLA = 
//------------------------------------------------------------
//------------------------------------------------------------
Fecha : 22/09/2015 16:37 
Error : You have an error in your SQL syntax; check the manual that corresponds to your MySQL server version for the right syntax to use near '' at line 1
SQL   : SELECT IMP_OPCIONAL FROM PDV_C_TAQUILLA WHERE ID_TERMINAL = 'OAX' AND IP = '192.168.2.203' AND ID_TAQUILLA = 
//------------------------------------------------------------
//------------------------------------------------------------
Fecha : 22/09/2015 16:37 
Error : You have an error in your SQL syntax; check the manual that corresponds to your MySQL server version for the right syntax to use near 'AND IP = '192.168.2.203'' at line 1
SQL   : SELECT APAGADO FROM PDV_C_TAQUILLA WHERE ID_TERMINAL = 'OAX' AND ID_TAQUILLA =  AND IP = '192.168.2.203' 
//------------------------------------------------------------
//------------------------------------------------------------
Fecha : 22/09/2015 16:37 
Error : You have an error in your SQL syntax; check the manual that corresponds to your MySQL server version for the right syntax to use near 'AND IP = '192.168.2.203'' at line 1
SQL   : SELECT TIEMPO_APAGADO FROM PDV_C_TAQUILLA WHERE ID_TERMINAL = 'OAX' AND ID_TAQUILLA =  AND IP = '192.168.2.203'
//------------------------------------------------------------
//------------------------------------------------------------
Fecha : 22/09/2015 16:38 
Error : You have an error in your SQL syntax; check the manual that corresponds to your MySQL server version for the right syntax to use near ''192.168.2.203')' at line 1
SQL   : INSERT INTO PDV_C_TAQUILLA(ID_TERMINAL, ID_TAQUILLA, IP) VALUES('OAX',,'192.168.2.203');
//------------------------------------------------------------
//------------------------------------------------------------
Fecha : 22/09/2015 16:38 
Error : You have an error in your SQL syntax; check the manual that corresponds to your MySQL server version for the right syntax to use near '' at line 1
SQL   : SELECT IMP_BOLETO FROM PDV_C_TAQUILLA WHERE ID_TERMINAL = 'OAX' AND IP = '192.168.2.203' AND ID_TAQUILLA = 
//------------------------------------------------------------
//------------------------------------------------------------
Fecha : 22/09/2015 16:38 
Error : You have an error in your SQL syntax; check the manual that corresponds to your MySQL server version for the right syntax to use near '' at line 1
SQL   : SELECT IMP_OPCIONAL FROM PDV_C_TAQUILLA WHERE ID_TERMINAL = 'OAX' AND IP = '192.168.2.203' AND ID_TAQUILLA = 
//------------------------------------------------------------
//------------------------------------------------------------
Fecha : 22/09/2015 16:38 
Error : You have an error in your SQL syntax; check the manual that corresponds to your MySQL server version for the right syntax to use near 'AND IP = '192.168.2.203'' at line 1
SQL   : SELECT APAGADO FROM PDV_C_TAQUILLA WHERE ID_TERMINAL = 'OAX' AND ID_TAQUILLA =  AND IP = '192.168.2.203' 
//------------------------------------------------------------
//------------------------------------------------------------
Fecha : 22/09/2015 16:38 
Error : You have an error in your SQL syntax; check the manual that corresponds to your MySQL server version for the right syntax to use near 'AND IP = '192.168.2.203'' at line 1
SQL   : SELECT TIEMPO_APAGADO FROM PDV_C_TAQUILLA WHERE ID_TERMINAL = 'OAX' AND ID_TAQUILLA =  AND IP = '192.168.2.203'
//------------------------------------------------------------
//------------------------------------------------------------
Fecha : 22/09/2015 16:39 
Error : You have an error in your SQL syntax; check the manual that corresponds to your MySQL server version for the right syntax to use near 'AND IP = '192.168.2.203'' at line 1
SQL   : SELECT APAGADO FROM PDV_C_TAQUILLA WHERE ID_TERMINAL = 'OAX' AND ID_TAQUILLA =  AND IP = '192.168.2.203' 
//------------------------------------------------------------
//------------------------------------------------------------
Fecha : 22/09/2015 16:39 
Error : You have an error in your SQL syntax; check the manual that corresponds to your MySQL server version for the right syntax to use near 'AND IP = '192.168.2.203'' at line 1
SQL   : SELECT TIEMPO_APAGADO FROM PDV_C_TAQUILLA WHERE ID_TERMINAL = 'OAX' AND ID_TAQUILLA =  AND IP = '192.168.2.203'
//------------------------------------------------------------
//------------------------------------------------------------
Fecha : 22/09/2015 16:40 
Error : You have an error in your SQL syntax; check the manual that corresponds to your MySQL server version for the right syntax to use near 'AND IP = '192.168.2.203'' at line 1
SQL   : SELECT APAGADO FROM PDV_C_TAQUILLA WHERE ID_TERMINAL = 'OAX' AND ID_TAQUILLA =  AND IP = '192.168.2.203' 
//------------------------------------------------------------
//------------------------------------------------------------
Fecha : 22/09/2015 16:40 
Error : You have an error in your SQL syntax; check the manual that corresponds to your MySQL server version for the right syntax to use near 'AND IP = '192.168.2.203'' at line 1
SQL   : SELECT TIEMPO_APAGADO FROM PDV_C_TAQUILLA WHERE ID_TERMINAL = 'OAX' AND ID_TAQUILLA =  AND IP = '192.168.2.203'
//------------------------------------------------------------
//------------------------------------------------------------
Fecha : 24/09/2015 09:39 
Error : Access denied for user 'venta'@'localhost' (using password: YES)
SQL   : SELECT APAGADO FROM PDV_C_TAQUILLA WHERE ID_TERMINAL = 'ZAC' AND ID_TAQUILLA = 10000 AND IP = '192.168.2.203' 
//------------------------------------------------------------
//------------------------------------------------------------
Fecha : 24/09/2015 09:39 
Error : Access denied for user 'venta'@'localhost' (using password: YES)
SQL   : SELECT TIEMPO_APAGADO FROM PDV_C_TAQUILLA WHERE ID_TERMINAL = 'ZAC' AND ID_TAQUILLA = 10000 AND IP = '192.168.2.203'
//------------------------------------------------------------
//------------------------------------------------------------
Fecha : 30/09/2015 13:30 
Error : Unknown column 'T.CONEXION_CENTRAL' in 'field list'
SQL   : SELECT T.CONEXION_CENTRAL FROM PDV_C_TAQUILLA T WHERE T.ID_TERMINAL = 'MEX' AND T.ID_TAQUILLA = 1000 AND T.IP = '192.168.2.203' 
//------------------------------------------------------------
//------------------------------------------------------------
Fecha : 30/09/2015 16:59 
Error : Duplicate entry '10778-2015-09-30' for key 1
SQL   : INSERT INTO PDV_C_GUIA_PRECAPTURA(ID_CORRIDA, FECHA, DESTINO, ID_RUTA, NOBUS, OPERADOR) VALUES('10778', '2015-09-30', 'JOJ', 31, 1, TRIM('999999'))
//------------------------------------------------------------
//------------------------------------------------------------
Fecha : 01/10/2015 12:25 
Error : Duplicate entry '10607-2015-10-01' for key 1
SQL   : INSERT INTO PDV_C_GUIA_PRECAPTURA(ID_CORRIDA, FECHA, DESTINO, ID_RUTA, NOBUS, OPERADOR) VALUES('10607', '2015-10-01', 'BVC', 1678, 1, TRIM('999999'))
//------------------------------------------------------------
//------------------------------------------------------------
Fecha : 01/10/2015 12:36 
Error : Duplicate entry '10770-2015-10-01' for key 1
SQL   : INSERT INTO PDV_C_GUIA_PRECAPTURA(ID_CORRIDA, FECHA, DESTINO, ID_RUTA, NOBUS, OPERADOR) VALUES('10770', '2015-10-01', 'BVC', 1678, 1, TRIM('999999'))
//------------------------------------------------------------
//------------------------------------------------------------
Fecha : 01/10/2015 12:51 
Error : Duplicate entry '10770-2015-10-01' for key 1
SQL   : INSERT INTO PDV_C_GUIA_PRECAPTURA(ID_CORRIDA, FECHA, DESTINO, ID_RUTA, NOBUS, OPERADOR) VALUES('10770', '2015-10-01', 'BVC', 1678, 1, TRIM('999999'))
//------------------------------------------------------------
//------------------------------------------------------------
Fecha : 01/10/2015 12:55 
Error : Duplicate entry '10770-2015-10-01' for key 1
SQL   : INSERT INTO PDV_C_GUIA_PRECAPTURA(ID_CORRIDA, FECHA, DESTINO, ID_RUTA, NOBUS, OPERADOR) VALUES('10770', '2015-10-01', 'BVC', 1678, 1, TRIM('999999'))
//------------------------------------------------------------
//------------------------------------------------------------
Fecha : 02/10/2015 11:42 
Error : Unknown column 'VERSION' in 'field list'
SQL   : UPDATE PDV_C_TAQUILLA SET VERSION = '2.095' WHERE ID_TERMINAL = 'MEX' AND  ID_TAQUILLA = '1000' AND IP = '192.168.2.203' 
//------------------------------------------------------------
//------------------------------------------------------------
Fecha : 02/10/2015 11:42 
Error : Unknown column 'T.CONEXION_CENTRAL' in 'field list'
SQL   : SELECT T.CONEXION_CENTRAL FROM PDV_C_TAQUILLA T WHERE T.ID_TERMINAL = 'MEX' AND T.ID_TAQUILLA = 1000 AND T.IP = '192.168.2.203' 
//------------------------------------------------------------
//------------------------------------------------------------
Fecha : 02/10/2015 13:44 
Error : FPago :PDV_STORE_VENTA_ASIENTO_DELETE
SQL   : Duplicate entry '1-10828-2015-10-03 23:30:00' for key 1
//------------------------------------------------------------
//------------------------------------------------------------
Fecha : 02/10/2015 17:10 
Error : Duplicate entry '10625-2015-10-02' for key 'PRIMARY'
SQL   : INSERT INTO PDV_C_GUIA_PRECAPTURA(ID_CORRIDA, FECHA, DESTINO, ID_RUTA, NOBUS, OPERADOR) VALUES('10625', '2015-10-02', 'MEX', 1715, 87, TRIM('X3-912'))
//------------------------------------------------------------
//------------------------------------------------------------
Fecha : 02/10/2015 17:14 
Error : Duplicate entry '10625-2015-10-02' for key 'PRIMARY'
SQL   : INSERT INTO PDV_C_GUIA_PRECAPTURA(ID_CORRIDA, FECHA, DESTINO, ID_RUTA, NOBUS, OPERADOR) VALUES('10625', '2015-10-02', 'MEX', 1715, 87, TRIM('X3-912'))
//------------------------------------------------------------
//------------------------------------------------------------
Fecha : 07/10/2015 09:34 
Error : Can't connect to MySQL server on '192.168.7.5' (10060)
SQL   : UPDATE PDV_C_TAQUILLA SET VERSION = '2.097' WHERE ID_TERMINAL = 'CCS' AND  ID_TAQUILLA = '1000' AND IP = '192.168.2.203' 
//------------------------------------------------------------
//------------------------------------------------------------
Fecha : 08/10/2015 11:06 
Error : UPDATE command denied to user 'venta'@'192.168.2.203' for table 'PDV_C_TAQUILLA'
SQL   : UPDATE PDV_C_TAQUILLA SET VERSION = '2.098' WHERE ID_TERMINAL = 'CCS' AND  ID_TAQUILLA = '1000' AND IP = '192.168.2.203' 
//------------------------------------------------------------
//------------------------------------------------------------
Fecha : 08/10/2015 11:14 
Error : UPDATE command denied to user 'venta'@'192.168.2.203' for table 'PDV_C_TAQUILLA'
SQL   : UPDATE PDV_C_TAQUILLA SET VERSION = '2.098' WHERE ID_TERMINAL = 'CCS' AND  ID_TAQUILLA = '1000' AND IP = '192.168.2.203' 
//------------------------------------------------------------
//------------------------------------------------------------
Fecha : 08/10/2015 11:24 
Error : UPDATE command denied to user 'venta'@'192.168.2.203' for table 'PDV_C_TAQUILLA'
SQL   : UPDATE PDV_C_TAQUILLA SET VERSION = '2.098' WHERE ID_TERMINAL = 'CCS' AND  ID_TAQUILLA = '1000' AND IP = '192.168.2.203' 
//------------------------------------------------------------
//------------------------------------------------------------
Fecha : 12/10/2015 11:41 
Error : Can't connect to MySQL server on '192.168.19.22' (10060)
SQL   : SELECT APAGADO FROM PDV_C_TAQUILLA WHERE ID_TERMINAL = 'TMF' AND ID_TAQUILLA = 1000 AND IP = '192.168.2.203' 
//------------------------------------------------------------
//------------------------------------------------------------
Fecha : 12/10/2015 11:41 
Error : Can't connect to MySQL server on '192.168.19.22' (10060)
SQL   : SELECT TIEMPO_APAGADO FROM PDV_C_TAQUILLA WHERE ID_TERMINAL = 'TMF' AND ID_TAQUILLA = 1000 AND IP = '192.168.2.203'
//------------------------------------------------------------
//------------------------------------------------------------
Fecha : 12/10/2015 11:47 
Error : Can't connect to MySQL server on '192.168.19.22' (10060)
SQL   : SELECT APAGADO FROM PDV_C_TAQUILLA WHERE ID_TERMINAL = 'TMF' AND ID_TAQUILLA = 1000 AND IP = '192.168.2.203' 
//------------------------------------------------------------
//------------------------------------------------------------
Fecha : 12/10/2015 11:47 
Error : Can't connect to MySQL server on '192.168.19.22' (10060)
SQL   : SELECT TIEMPO_APAGADO FROM PDV_C_TAQUILLA WHERE ID_TERMINAL = 'TMF' AND ID_TAQUILLA = 1000 AND IP = '192.168.2.203'
//------------------------------------------------------------
//------------------------------------------------------------
Fecha : 12/10/2015 12:10 
Error : Unknown column 'tmf' in 'field list'
SQL   : INSERT INTO PDV_C_TAQUILLA(ID_TERMINAL, ID_TAQUILLA, IP) VALUES('1000',tmf,'192.168.2.203');
//------------------------------------------------------------
//------------------------------------------------------------
Fecha : 12/10/2015 12:11 
Error : Unknown column 'tmf' in 'where clause'
SQL   : SELECT IMP_BOLETO FROM PDV_C_TAQUILLA WHERE ID_TERMINAL = '1000' AND IP = '192.168.2.203' AND ID_TAQUILLA = tmf
//------------------------------------------------------------
//------------------------------------------------------------
Fecha : 12/10/2015 12:11 
Error : Unknown column 'tmf' in 'where clause'
SQL   : SELECT IMP_OPCIONAL FROM PDV_C_TAQUILLA WHERE ID_TERMINAL = '1000' AND IP = '192.168.2.203' AND ID_TAQUILLA = tmf
//------------------------------------------------------------
//------------------------------------------------------------
Fecha : 12/10/2015 12:11 
Error : Unknown column 'tmf' in 'where clause'
SQL   : SELECT APAGADO FROM PDV_C_TAQUILLA WHERE ID_TERMINAL = '1000' AND ID_TAQUILLA = tmf AND IP = '192.168.2.203' 
//------------------------------------------------------------
//------------------------------------------------------------
Fecha : 12/10/2015 12:11 
Error : Unknown column 'tmf' in 'where clause'
SQL   : SELECT TIEMPO_APAGADO FROM PDV_C_TAQUILLA WHERE ID_TERMINAL = '1000' AND ID_TAQUILLA = tmf AND IP = '192.168.2.203'
//------------------------------------------------------------
//------------------------------------------------------------
Fecha : 12/10/2015 12:35 
Error : Duplicate entry '11390-2015-10-12' for key 1
SQL   : INSERT INTO PDV_C_GUIA_PRECAPTURA(ID_CORRIDA, FECHA, DESTINO, ID_RUTA, NOBUS, OPERADOR) VALUES('11390', '2015-10-12', 'VAC', 1769, 8, TRIM('X3-198'))
//------------------------------------------------------------
//------------------------------------------------------------
Fecha : 13/10/2015 16:21 
Error : Duplicate entry 'JOJ64-2015-10-13' for key 1
SQL   : INSERT INTO PDV_C_GUIA_PRECAPTURA(ID_CORRIDA, FECHA, DESTINO, ID_RUTA, NOBUS, OPERADOR) VALUES('JOJ64', '2015-10-13', 'GAL', 1959, 557, TRIM('X4-108'))
//------------------------------------------------------------
//------------------------------------------------------------
Fecha : 16/10/2015 16:32 
Error : UPDATE command denied to user 'venta'@'192.168.2.203' for table 'PDV_C_TAQUILLA'
SQL   : UPDATE PDV_C_TAQUILLA SET VERSION = '2.098' WHERE ID_TERMINAL = 'MEX' AND  ID_TAQUILLA = '1000' AND IP = '192.168.2.203' 
//------------------------------------------------------------
//------------------------------------------------------------
Fecha : 16/10/2015 16:42 
Error : UPDATE command denied to user 'venta'@'192.168.2.203' for table 'PDV_C_TAQUILLA'
SQL   : UPDATE PDV_C_TAQUILLA SET VERSION = '2.098' WHERE ID_TERMINAL = 'MEX' AND  ID_TAQUILLA = '1000' AND IP = '192.168.2.203' 
//------------------------------------------------------------
//------------------------------------------------------------
Fecha : 16/10/2015 16:43 
Error : UPDATE command denied to user 'venta'@'192.168.2.203' for table 'PDV_C_TAQUILLA'
SQL   : UPDATE PDV_C_TAQUILLA SET VERSION = '2.098' WHERE ID_TERMINAL = 'MEX' AND  ID_TAQUILLA = '1000' AND IP = '192.168.2.203' 
//------------------------------------------------------------
//------------------------------------------------------------
Fecha : 16/10/2015 16:54 
Error : UPDATE command denied to user 'venta'@'192.168.2.203' for table 'PDV_C_TAQUILLA'
SQL   : UPDATE PDV_C_TAQUILLA SET VERSION = '2.098' WHERE ID_TERMINAL = 'MEX' AND  ID_TAQUILLA = '1000' AND IP = '192.168.2.203' 
//------------------------------------------------------------
//------------------------------------------------------------
Fecha : 16/10/2015 16:56 
Error : Unknown column 'VERSION' in 'field list'
SQL   : UPDATE PDV_C_TAQUILLA SET VERSION = '2.098' WHERE ID_TERMINAL = 'MEX' AND  ID_TAQUILLA = '1000' AND IP = '192.168.2.203' 
//------------------------------------------------------------
//------------------------------------------------------------
Fecha : 16/10/2015 17:09 
Error : UPDATE command denied to user 'venta'@'192.168.2.203' for table 'PDV_C_TAQUILLA'
SQL   : UPDATE PDV_C_TAQUILLA SET VERSION = '2.098' WHERE ID_TERMINAL = 'MEX' AND  ID_TAQUILLA = '1000' AND IP = '192.168.2.203' 
//------------------------------------------------------------
//------------------------------------------------------------
Fecha : 19/10/2015 10:17 
Error : UPDATE command denied to user 'venta'@'192.168.2.203' for table 'PDV_C_TAQUILLA'
SQL   : UPDATE PDV_C_TAQUILLA SET VERSION = '2.098' WHERE ID_TERMINAL = 'CCS' AND  ID_TAQUILLA = '1000' AND IP = '192.168.2.203' 
//------------------------------------------------------------
//------------------------------------------------------------
Fecha : 19/10/2015 10:18 
Error : UPDATE command denied to user 'venta'@'192.168.2.203' for table 'PDV_C_TAQUILLA'
SQL   : UPDATE PDV_C_TAQUILLA SET VERSION = '2.098' WHERE ID_TERMINAL = 'CCS' AND  ID_TAQUILLA = '1000' AND IP = '192.168.2.203' 
//------------------------------------------------------------
//------------------------------------------------------------
Fecha : 19/10/2015 10:19 
Error : UPDATE command denied to user 'venta'@'192.168.2.203' for table 'PDV_C_TAQUILLA'
SQL   : UPDATE PDV_C_TAQUILLA SET VERSION = '2.098' WHERE ID_TERMINAL = 'CCS' AND  ID_TAQUILLA = '1000' AND IP = '192.168.2.203' 
//------------------------------------------------------------
//------------------------------------------------------------
Fecha : 19/10/2015 10:19 
Error : UPDATE command denied to user 'venta'@'192.168.2.203' for table 'PDV_C_TAQUILLA'
SQL   : UPDATE PDV_C_TAQUILLA SET VERSION = '2.098' WHERE ID_TERMINAL = 'CCS' AND  ID_TAQUILLA = '1000' AND IP = '192.168.2.203' 
//------------------------------------------------------------
//------------------------------------------------------------
Fecha : 19/10/2015 13:35 
Error : UPDATE command denied to user 'venta'@'192.168.2.203' for table 'PDV_C_TAQUILLA'
SQL   : UPDATE PDV_C_TAQUILLA SET VERSION = '2.098' WHERE ID_TERMINAL = 'CCS' AND  ID_TAQUILLA = '1000' AND IP = '192.168.2.203' 
//------------------------------------------------------------
//------------------------------------------------------------
Fecha : 19/10/2015 14:11 
Error : Duplicate entry 'MEX36-2015-10-19' for key 1
SQL   : INSERT INTO PDV_C_GUIA_PRECAPTURA(ID_CORRIDA, FECHA, DESTINO, ID_RUTA, NOBUS, OPERADOR) VALUES('MEX36', '2015-10-19', 'AER', 523, 916, TRIM('X2-646'))
//------------------------------------------------------------
//------------------------------------------------------------
Fecha : 20/10/2015 11:44 
Error : UPDATE command denied to user 'venta'@'192.168.2.203' for table 'PDV_C_TAQUILLA'
SQL   : UPDATE PDV_C_TAQUILLA SET VERSION = '2.099' WHERE ID_TERMINAL = 'CCS' AND  ID_TAQUILLA = '1000' AND IP = '192.168.2.203' 
//------------------------------------------------------------
//------------------------------------------------------------
Fecha : 20/10/2015 11:47 
Error : UPDATE command denied to user 'venta'@'192.168.2.203' for table 'PDV_C_TAQUILLA'
SQL   : UPDATE PDV_C_TAQUILLA SET VERSION = '2.099' WHERE ID_TERMINAL = 'CCS' AND  ID_TAQUILLA = '1000' AND IP = '192.168.2.203' 
//------------------------------------------------------------
//------------------------------------------------------------
Fecha : 20/10/2015 12:41 
Error : UPDATE command denied to user 'venta'@'192.168.2.203' for table 'PDV_C_TAQUILLA'
SQL   : UPDATE PDV_C_TAQUILLA SET VERSION = '2.099' WHERE ID_TERMINAL = 'CCS' AND  ID_TAQUILLA = '1000' AND IP = '192.168.2.203' 
//------------------------------------------------------------
//------------------------------------------------------------
Fecha : 20/10/2015 13:27 
Error : UPDATE command denied to user 'venta'@'192.168.2.203' for table 'PDV_C_TAQUILLA'
SQL   : UPDATE PDV_C_TAQUILLA SET VERSION = '2.099' WHERE ID_TERMINAL = 'CCS' AND  ID_TAQUILLA = '1000' AND IP = '192.168.2.203' 
//------------------------------------------------------------
//------------------------------------------------------------
Fecha : 20/10/2015 13:50 
Error : Can't connect to MySQL server on '192.168.5.5' (10060)
SQL   : INSERT INTO PDV_C_GRUPO_PRIVILEGIOS(ID_GRUPO, ID_PRIVILEGIO) VALUES(1815,170)
//------------------------------------------------------------
//------------------------------------------------------------
Fecha : 20/10/2015 13:56 
Error : Can't connect to MySQL server on '192.168.5.5' (10060)
SQL   : INSERT INTO PDV_C_GRUPO_PRIVILEGIOS(ID_GRUPO, ID_PRIVILEGIO) VALUES(422,102)
//------------------------------------------------------------
//------------------------------------------------------------
Fecha : 20/10/2015 14:03 
Error : Can't connect to MySQL server on '192.168.5.5' (10060)
SQL   : INSERT INTO PDV_C_GRUPO_PRIVILEGIOS(ID_GRUPO, ID_PRIVILEGIO) VALUES(1477,169)
//------------------------------------------------------------
//------------------------------------------------------------
Fecha : 20/10/2015 14:04 
Error : Can't connect to MySQL server on '192.168.5.5' (10060)
SQL   : INSERT INTO PDV_C_GRUPO_PRIVILEGIOS(ID_GRUPO, ID_PRIVILEGIO) VALUES(3055,115)
//------------------------------------------------------------
//------------------------------------------------------------
Fecha : 21/10/2015 17:37 
Error : UPDATE command denied to user 'venta'@'192.168.2.203' for table 'PDV_C_TAQUILLA'
SQL   : UPDATE PDV_C_TAQUILLA SET VERSION = '2.099' WHERE ID_TERMINAL = 'CCS' AND  ID_TAQUILLA = '1000' AND IP = '192.168.2.203' 
//------------------------------------------------------------
//------------------------------------------------------------
Fecha : 21/10/2015 17:39 
Error : UPDATE command denied to user 'venta'@'192.168.2.203' for table 'PDV_C_TAQUILLA'
SQL   : UPDATE PDV_C_TAQUILLA SET VERSION = '2.099' WHERE ID_TERMINAL = 'CCS' AND  ID_TAQUILLA = '1000' AND IP = '192.168.2.203' 
//------------------------------------------------------------
//------------------------------------------------------------
Fecha : 21/10/2015 17:41 
Error : Can't connect to MySQL server on '192.168.7.5' (10060)
SQL   : SELECT CURRENT_TIME AS HORA
//------------------------------------------------------------
//------------------------------------------------------------
Fecha : 21/10/2015 17:44 
Error : Can't connect to MySQL server on '192.168.7.5' (10060)
SQL   : SELECT CURRENT_TIME AS HORA
//------------------------------------------------------------
//------------------------------------------------------------
Fecha : 21/10/2015 17:45 
Error : Can't connect to MySQL server on '192.168.7.5' (10060)
SQL   : SELECT CURRENT_TIME AS HORA
//------------------------------------------------------------
//------------------------------------------------------------
Fecha : 21/10/2015 17:55 
Error : UPDATE command denied to user 'venta'@'192.168.2.203' for table 'PDV_C_TAQUILLA'
SQL   : UPDATE PDV_C_TAQUILLA SET VERSION = '2.099' WHERE ID_TERMINAL = 'CCS' AND  ID_TAQUILLA = '1000' AND IP = '192.168.2.203' 
//------------------------------------------------------------
//------------------------------------------------------------
Fecha : 22/10/2015 10:07 
Error : UPDATE command denied to user 'venta'@'192.168.2.203' for table 'PDV_C_TAQUILLA'
SQL   : UPDATE PDV_C_TAQUILLA SET VERSION = '2.099' WHERE ID_TERMINAL = 'CCS' AND  ID_TAQUILLA = '1000' AND IP = '192.168.2.203' 
//------------------------------------------------------------
//------------------------------------------------------------
Fecha : 22/10/2015 10:10 
Error : UPDATE command denied to user 'venta'@'192.168.2.203' for table 'PDV_C_TAQUILLA'
SQL   : UPDATE PDV_C_TAQUILLA SET VERSION = '2.099' WHERE ID_TERMINAL = 'CCS' AND  ID_TAQUILLA = '1000' AND IP = '192.168.2.203' 
//------------------------------------------------------------
//------------------------------------------------------------
Fecha : 22/10/2015 10:15 
Error : UPDATE command denied to user 'venta'@'192.168.2.203' for table 'PDV_C_TAQUILLA'
SQL   : UPDATE PDV_C_TAQUILLA SET VERSION = '2.099' WHERE ID_TERMINAL = 'CCS' AND  ID_TAQUILLA = '1000' AND IP = '192.168.2.203' 
//------------------------------------------------------------
//------------------------------------------------------------
Fecha : 22/10/2015 10:17 
Error : UPDATE command denied to user 'venta'@'192.168.2.203' for table 'PDV_C_TAQUILLA'
SQL   : UPDATE PDV_C_TAQUILLA SET VERSION = '2.099' WHERE ID_TERMINAL = 'CCS' AND  ID_TAQUILLA = '1000' AND IP = '192.168.2.203' 
//------------------------------------------------------------
//------------------------------------------------------------
Fecha : 24/10/2015 05:40 
Error : Unknown column 'CCS' in 'field list'
SQL   : INSERT INTO PDV_C_TAQUILLA(ID_TERMINAL, ID_TAQUILLA, IP) VALUES('1000',CCS,'192.168.2.203');
//------------------------------------------------------------
//------------------------------------------------------------
Fecha : 24/10/2015 05:40 
Error : UPDATE command denied to user 'venta'@'192.168.2.203' for table 'PDV_C_TAQUILLA'
SQL   : UPDATE PDV_C_TAQUILLA SET VERSION = '2.099' WHERE ID_TERMINAL = '1000' AND  ID_TAQUILLA = 'CCS' AND IP = '192.168.2.203' 
//------------------------------------------------------------
//------------------------------------------------------------
Fecha : 24/10/2015 05:40 
Error : Unknown column 'CCS' in 'where clause'
SQL   : SELECT IMP_BOLETO FROM PDV_C_TAQUILLA WHERE ID_TERMINAL = '1000' AND IP = '192.168.2.203' AND ID_TAQUILLA = CCS
//------------------------------------------------------------
//------------------------------------------------------------
Fecha : 24/10/2015 05:40 
Error : Unknown column 'CCS' in 'where clause'
SQL   : SELECT IMP_OPCIONAL FROM PDV_C_TAQUILLA WHERE ID_TERMINAL = '1000' AND IP = '192.168.2.203' AND ID_TAQUILLA = CCS
//------------------------------------------------------------
//------------------------------------------------------------
Fecha : 24/10/2015 05:41 
Error : Unknown column 'CCS' in 'where clause'
SQL   : SELECT APAGADO FROM PDV_C_TAQUILLA WHERE ID_TERMINAL = '1000' AND ID_TAQUILLA = CCS AND IP = '192.168.2.203' 
//------------------------------------------------------------
//------------------------------------------------------------
Fecha : 24/10/2015 05:41 
Error : Unknown column 'CCS' in 'where clause'
SQL   : SELECT TIEMPO_APAGADO FROM PDV_C_TAQUILLA WHERE ID_TERMINAL = '1000' AND ID_TAQUILLA = CCS AND IP = '192.168.2.203'
//------------------------------------------------------------
//------------------------------------------------------------
Fecha : 24/10/2015 05:41 
Error : UPDATE command denied to user 'venta'@'192.168.2.203' for table 'PDV_C_TAQUILLA'
SQL   : UPDATE PDV_C_TAQUILLA SET VERSION = '2.099' WHERE ID_TERMINAL = 'CCS' AND  ID_TAQUILLA = '1000' AND IP = '192.168.2.203' 
//------------------------------------------------------------
//------------------------------------------------------------
Fecha : 24/10/2015 05:55 
Error : Can't connect to MySQL server on '192.168.5.5' (10060)
SQL   : SELECT CURRENT_TIME AS HORA
//------------------------------------------------------------
//------------------------------------------------------------
Fecha : 28/10/2015 16:53 
Error : Can't connect to MySQL server on '192.168.5.5' (10060)
SQL   : SELECT T.VENTA_MASIVA FROM PDV_C_TAQUILLA T WHERE T.ID_TAQUILLA = 1000 AND ID_TERMINAL = 'MEX'
//------------------------------------------------------------
//------------------------------------------------------------
Fecha : 28/10/2015 16:57 
Error : Lost connection to MySQL server at 'reading authorization packet', system error: 2
SQL   : SELECT CURRENT_TIME AS HORA
//------------------------------------------------------------
//------------------------------------------------------------
Fecha : 29/10/2015 09:40 
Error : UPDATE command denied to user 'venta'@'192.168.2.203' for table 'PDV_C_TAQUILLA'
SQL   : UPDATE PDV_C_TAQUILLA SET VERSION = '2.099' WHERE ID_TERMINAL = 'CCS' AND  ID_TAQUILLA = '1000' AND IP = '192.168.2.203' 
//------------------------------------------------------------
//------------------------------------------------------------
Fecha : 29/10/2015 09:49 
Error : UPDATE command denied to user 'venta'@'192.168.2.203' for table 'PDV_C_TAQUILLA'
SQL   : UPDATE PDV_C_TAQUILLA SET VERSION = '2.099' WHERE ID_TERMINAL = 'CCS' AND  ID_TAQUILLA = '1000' AND IP = '192.168.2.203' 
//------------------------------------------------------------
//------------------------------------------------------------
Fecha : 30/10/2015 11:57 
Error : Can't connect to MySQL server on '192.168.5.5' (10060)
SQL   : SELECT ID_GRUPO, ID_PRIVILEGIO FROM PDV_C_GRUPO_PRIVILEGIOS WHERE ID_GRUPO = '1477'
//------------------------------------------------------------
//------------------------------------------------------------
Fecha : 30/10/2015 17:54 
Error : Lost connection to MySQL server at 'reading authorization packet', system error: 2
SQL   : SELECT U.TRAB_ID, U.NOMBRE AS NOMBRE FROM PDV_C_USUARIO U INNER JOIN EMPLEADOS E ON U.TRAB_ID = E.TRAB_ID WHERE FECHA_BAJA IS NULL
//------------------------------------------------------------
//------------------------------------------------------------
Fecha : 17/11/2015 15:24 
Error : UPDATE command denied to user 'venta'@'192.168.2.203' for table 'PDV_C_TAQUILLA'
SQL   : UPDATE PDV_C_TAQUILLA SET VERSION = '2.0992' WHERE ID_TERMINAL = 'XCO' AND  ID_TAQUILLA = '1000' AND IP = '192.168.2.203' 
//------------------------------------------------------------
//------------------------------------------------------------
Fecha : 17/11/2015 16:23 
Error : Duplicate entry '022195' for key 1
SQL   : INSERT EMPLEADOS(TRAB_ID, NOMBRES, PATERNO, MATERNO, STATUS, ID_SERVICIO, ID_SERVICIO_ACTUAL,TIPO_EMPLEADO, PUESTO_ID) VALUES('022195','MAXIMILIANO','CRUZ','MALDONADO','ACTIVO',0,0,0,874)
//------------------------------------------------------------
//------------------------------------------------------------
Fecha : 18/11/2015 17:28 
Error : UPDATE command denied to user 'venta'@'192.168.2.203' for table 'PDV_C_TAQUILLA'
SQL   : UPDATE PDV_C_TAQUILLA SET VERSION = '2.0992' WHERE ID_TERMINAL = 'MIA' AND  ID_TAQUILLA = '1000' AND IP = '192.168.2.203' 
//------------------------------------------------------------
//------------------------------------------------------------
Fecha : 26/11/2015 11:25 
Error : Access denied for user 'venta'@'localhost' (using password: YES)
SQL   : SELECT APAGADO FROM PDV_C_TAQUILLA WHERE ID_TERMINAL = '?' AND ID_TAQUILLA =  AND IP = '???þ' 
//------------------------------------------------------------
//------------------------------------------------------------
Fecha : 26/11/2015 11:25 
Error : Access denied for user 'venta'@'localhost' (using password: YES)
SQL   : SELECT TIEMPO_APAGADO FROM PDV_C_TAQUILLA WHERE ID_TERMINAL = '?' AND ID_TAQUILLA =  AND IP = '???þ'
//------------------------------------------------------------
//------------------------------------------------------------
Fecha : 02/12/2015 13:36 
Error : UPDATE command denied to user 'venta'@'192.168.2.203' for table 'PDV_C_TAQUILLA'
SQL   : UPDATE PDV_C_TAQUILLA SET VERSION = '2.0992' WHERE ID_TERMINAL = 'TET' AND  ID_TAQUILLA = '1000' AND IP = '192.168.2.203' 
//------------------------------------------------------------
//------------------------------------------------------------
Fecha : 02/12/2015 13:38 
Error : SELECT command denied to user 'venta'@'192.168.2.203' for table 'PDV_C_GUIA_PRECAPTURA'
SQL   : SELECT NOBUS, TRIM(OPERADOR)AS OPERADOR FROM PDV_C_GUIA_PRECAPTURA WHERE ID_CORRIDA = '10380' AND FECHA = '2015-12-02' AND DESTINO = 'CUE' 
//------------------------------------------------------------
//------------------------------------------------------------
Fecha : 02/12/2015 13:41 
Error : UPDATE command denied to user 'venta'@'192.168.2.203' for table 'PDV_C_TAQUILLA'
SQL   : UPDATE PDV_C_TAQUILLA SET VERSION = '2.0992' WHERE ID_TERMINAL = 'TET' AND  ID_TAQUILLA = '1000' AND IP = '192.168.2.203' 
//------------------------------------------------------------
//------------------------------------------------------------
Fecha : 02/12/2015 13:54 
Error : UPDATE command denied to user 'venta'@'192.168.2.203' for table 'PDV_C_TAQUILLA'
SQL   : UPDATE PDV_C_TAQUILLA SET VERSION = '2.0992' WHERE ID_TERMINAL = 'TET' AND  ID_TAQUILLA = '1000' AND IP = '192.168.2.203' 
//------------------------------------------------------------
//------------------------------------------------------------
Fecha : 02/12/2015 13:56 
Error : UPDATE command denied to user 'venta'@'192.168.2.203' for table 'PDV_C_TAQUILLA'
SQL   : UPDATE PDV_C_TAQUILLA SET VERSION = '2.0992' WHERE ID_TERMINAL = 'TET' AND  ID_TAQUILLA = '1000' AND IP = '192.168.2.203' 
//------------------------------------------------------------
//------------------------------------------------------------
Fecha : 02/12/2015 13:58 
Error : UPDATE command denied to user 'venta'@'192.168.2.203' for table 'PDV_C_TAQUILLA'
SQL   : UPDATE PDV_C_TAQUILLA SET VERSION = '2.0992' WHERE ID_TERMINAL = 'TET' AND  ID_TAQUILLA = '1000' AND IP = '192.168.2.203' 
//------------------------------------------------------------
//------------------------------------------------------------
Fecha : 13/04/2016 09:52 
Error : Can't connect to MySQL server on 'localhost' (10061)
SQL   : SELECT APAGADO FROM PDV_C_TAQUILLA WHERE ID_TERMINAL = '?' AND ID_TAQUILLA =  AND IP = '???þ' 
//------------------------------------------------------------
//------------------------------------------------------------
Fecha : 13/04/2016 09:52 
Error : Can't connect to MySQL server on 'localhost' (10061)
SQL   : SELECT TIEMPO_APAGADO FROM PDV_C_TAQUILLA WHERE ID_TERMINAL = '?' AND ID_TAQUILLA =  AND IP = '???þ'
//------------------------------------------------------------
//------------------------------------------------------------
Fecha : 13/04/2016 10:06 
Error : Can't connect to MySQL server on 'localhost' (10061)
SQL   : SELECT APAGADO FROM PDV_C_TAQUILLA WHERE ID_TERMINAL = '?' AND ID_TAQUILLA =  AND IP = '???þ' 
//------------------------------------------------------------
//------------------------------------------------------------
Fecha : 13/04/2016 10:06 
Error : Can't connect to MySQL server on 'localhost' (10061)
SQL   : SELECT TIEMPO_APAGADO FROM PDV_C_TAQUILLA WHERE ID_TERMINAL = '?' AND ID_TAQUILLA =  AND IP = '???þ'
//------------------------------------------------------------
//------------------------------------------------------------
Fecha : 13/04/2016 10:06 
Error : UPDATE command denied to user 'venta'@'192.168.2.203' for table 'PDV_C_TAQUILLA'
SQL   : UPDATE PDV_C_TAQUILLA SET VERSION = '2.0992' WHERE ID_TERMINAL = 'MEX' AND  ID_TAQUILLA = '10000' AND IP = '192.168.56.1' 
//------------------------------------------------------------
//------------------------------------------------------------
Fecha : 13/04/2016 10:25 
Error : UPDATE command denied to user 'venta'@'192.168.2.203' for table 'PDV_C_TAQUILLA'
SQL   : UPDATE PDV_C_TAQUILLA SET VERSION = '2.0992' WHERE ID_TERMINAL = 'MEX' AND  ID_TAQUILLA = '10000' AND IP = '192.168.56.1' 
//------------------------------------------------------------
//------------------------------------------------------------
Fecha : 13/04/2016 10:31 
Error : UPDATE command denied to user 'venta'@'192.168.2.203' for table 'PDV_C_TAQUILLA'
SQL   : UPDATE PDV_C_TAQUILLA SET VERSION = '2.0992' WHERE ID_TERMINAL = 'MEX' AND  ID_TAQUILLA = '10000' AND IP = '192.168.56.1' 
//------------------------------------------------------------
//------------------------------------------------------------
Fecha : 13/04/2016 10:46 
Error : UPDATE command denied to user 'venta'@'192.168.2.203' for table 'PDV_C_TAQUILLA'
SQL   : UPDATE PDV_C_TAQUILLA SET VERSION = '2.0992' WHERE ID_TERMINAL = 'MEX' AND  ID_TAQUILLA = '10000' AND IP = '192.168.56.1' 
//------------------------------------------------------------
//------------------------------------------------------------
Fecha : 13/04/2016 10:49 
Error : UPDATE command denied to user 'venta'@'192.168.2.203' for table 'PDV_C_TAQUILLA'
SQL   : UPDATE PDV_C_TAQUILLA SET VERSION = '2.0992' WHERE ID_TERMINAL = 'MEX' AND  ID_TAQUILLA = '10000' AND IP = '192.168.56.1' 
//------------------------------------------------------------
//------------------------------------------------------------
Fecha : 13/04/2016 10:56 
Error : Duplicate entry '10568-2016-04-13' for key 'PRIMARY'
SQL   : INSERT INTO PDV_C_GUIA_PRECAPTURA(ID_CORRIDA, FECHA, DESTINO, ID_RUTA, NOBUS, OPERADOR) VALUES('10568', '2016-04-13', 'JOJ', 31, 4, TRIM('CR0310'))
//------------------------------------------------------------
//------------------------------------------------------------
Fecha : 13/04/2016 11:01 
Error : UPDATE command denied to user 'venta'@'192.168.2.203' for table 'PDV_C_TAQUILLA'
SQL   : UPDATE PDV_C_TAQUILLA SET VERSION = '2.0992' WHERE ID_TERMINAL = 'MEX' AND  ID_TAQUILLA = '10000' AND IP = '192.168.56.1' 
//------------------------------------------------------------
//------------------------------------------------------------
Fecha : 13/04/2016 11:07 
Error : UPDATE command denied to user 'venta'@'192.168.2.203' for table 'PDV_C_TAQUILLA'
SQL   : UPDATE PDV_C_TAQUILLA SET VERSION = '2.0993' WHERE ID_TERMINAL = 'MEX' AND  ID_TAQUILLA = '10000' AND IP = '192.168.56.1' 
//------------------------------------------------------------
//------------------------------------------------------------
Fecha : 25/04/2016 12:49 
Error : FPago :PDV_STORE_VENTA_ASIENTO_DELETE
SQL   : Duplicate entry '1-195-2016-04-25 20:30:00' for key 'PRIMARY'
//------------------------------------------------------------
//------------------------------------------------------------
Fecha : 25/04/2016 13:01 
Error : FPago :PDV_STORE_VENTA_ASIENTO_DELETE
SQL   : Duplicate entry '1-195-2016-04-25 20:30:00' for key 'PRIMARY'
//------------------------------------------------------------
//------------------------------------------------------------
Fecha : 25/04/2016 13:03 
Error : FPago :PDV_STORE_VENTA_ASIENTO_DELETE
SQL   : Duplicate entry '2-195-2016-04-25 20:30:00' for key 'PRIMARY'
//------------------------------------------------------------
//------------------------------------------------------------
Fecha : 27/04/2016 17:12 
Error : FPago :PDV_STORE_VENTA_ASIENTO_DELETE
SQL   : Duplicate entry '1-5308-2016-04-28 17:06:00' for key 'PRIMARY'
//------------------------------------------------------------
//------------------------------------------------------------
Fecha : 27/04/2016 17:30 
Error : FPago :PDV_STORE_VENTA_ASIENTO_DELETE
SQL   : Duplicate entry '2-5308-2016-04-28 17:06:00' for key 'PRIMARY'
//------------------------------------------------------------
//------------------------------------------------------------
Fecha : 27/04/2016 17:36 
Error : FPago :PDV_STORE_VENTA_ASIENTO_DELETE
SQL   : Duplicate entry '3-5308-2016-04-28 17:06:00' for key 'PRIMARY'
//------------------------------------------------------------
//------------------------------------------------------------
Fecha : 27/04/2016 17:53 
Error : FPago :PDV_STORE_VENTA_ASIENTO_DELETE
SQL   : Duplicate entry '4-5308-2016-04-28 17:06:00' for key 'PRIMARY'
//------------------------------------------------------------
//------------------------------------------------------------
Fecha : 27/04/2016 17:55 
Error : FPago :PDV_STORE_VENTA_ASIENTO_DELETE
SQL   : Duplicate entry '5-5308-2016-04-28 17:06:00' for key 'PRIMARY'
//------------------------------------------------------------
//------------------------------------------------------------
Fecha : 27/04/2016 18:01 
Error : MySQL server has gone away
SQL   : SELECT PIE FROM PDV_T_CORRIDA_D WHERE ID_CORRIDA = '5308' AND FECHA = '2016-04-28' AND ID_TERMINAL = 'MEX'
//------------------------------------------------------------
//------------------------------------------------------------
Fecha : 27/04/2016 18:02 
Error : FPago :PDV_STORE_VENTA_ASIENTO_DELETE
SQL   : Duplicate entry '6-5308-2016-04-28 17:06:00' for key 'PRIMARY'
//------------------------------------------------------------
//------------------------------------------------------------
Fecha : 04/05/2016 10:22 
Error : FPago :PDV_STORE_VENTA_ASIENTO_DELETE
SQL   : Duplicate entry '1-5336-2016-05-05 21:16:00' for key 'PRIMARY'
//------------------------------------------------------------
//------------------------------------------------------------
Fecha : 04/05/2016 10:26 
Error : FPago :PDV_STORE_VENTA_ASIENTO_DELETE
SQL   : Duplicate entry '2-5336-2016-05-05 21:16:00' for key 'PRIMARY'
//------------------------------------------------------------
//------------------------------------------------------------
Fecha : 04/05/2016 10:31 
Error : FPago :PDV_STORE_VENTA_ASIENTO_DELETE
SQL   : Duplicate entry '3-5336-2016-05-05 21:16:00' for key 'PRIMARY'
//------------------------------------------------------------
//------------------------------------------------------------
Fecha : 20/05/2016 10:27 
Error : Can't connect to MySQL server on '192.168.7.5' (10060)
SQL   : SELECT U.TRAB_ID, P.ID_PRIVILEGIO, U.PASSWORD,U.NOMBRE, U.FECHA_BAJA, U.FECHA_PASSWORD, P.ID_PRIVILEGIO FROM PDV_C_PRIVILEGIO P INNER JOIN PDV_C_GRUPO_PRIVILEGIOS PG ON P.ID_PRIVILEGIO = PG.ID_PRIVILEGIO                         INNER JOIN PDV_C_GRUPO_USUARIO PU ON PU.ID_GRUPO = PG.ID_GRUPO                         INNER JOIN PDV_C_USUARIO U ON U.ID_GRUPO = PU.ID_GRUPO WHERE U.FECHA_BAJA IS NULL AND U.TRAB_ID = 'root' AND U.PASSWORD = 'Optimuz12' AND P.ID_PRIVILEGIO = 154 UNION SELECT U.TRAB_ID, P.ID_PRIVILEGIO, U.PASSWORD,U.NOMBRE,U.FECHA_BAJA, U.FECHA_PASSWORD, P.ID_PRIVILEGIO FROM PDV_C_PRIVILEGIO P INNER JOIN PDV_C_PRIVILEGIO_C_USUARIO PU ON P.ID_PRIVILEGIO = PU.ID_PRIVILEGIO                         INNER JOIN PDV_C_USUARIO U ON U.TRAB_ID = PU.ID_EMPLEADO WHERE U.FECHA_BAJA IS NULL AND U.TRAB_ID = 'root' AND U.PASSWORD = 'Optimuz12' AND P.ID_PRIVILEGIO = 154 ORDER BY  1,2 
//------------------------------------------------------------
//------------------------------------------------------------
Fecha : 20/05/2016 10:30 
Error : Can't connect to MySQL server on '192.168.7.5' (10060)
SQL   : SELECT VALOR FROM PDV_C_PARAMETRO WHERE ID_PARAMETRO = 21
//------------------------------------------------------------
//------------------------------------------------------------
Fecha : 20/05/2016 10:41 
Error : SQLConnection property required for this operation
SQL   : SELECT U.TRAB_ID, (CONCAT(E.PATERNO,' ',E.MATERNO,' ',E.NOMBRES))AS NOMBRE FROM PDV_T_CORRIDA_D D INNER JOIN PDV_C_USUARIO U ON D.TRAB_ID = U.TRAB_ID                        INNER JOIN EMPLEADOS E ON E.TRAB_ID = U.TRAB_ID WHERE D.FECHA = '2016-05-20' AND D.HORA = '10:43' 
//------------------------------------------------------------
//------------------------------------------------------------
Fecha : 23/05/2016 13:42 
Error : Can't connect to MySQL server on '192.168.1.6' (10061)
SQL   : SELECT APAGADO FROM PDV_C_TAQUILLA WHERE ID_TERMINAL = 'AER' AND ID_TAQUILLA = 1000 AND IP = '192.168.56.1' 
//------------------------------------------------------------
//------------------------------------------------------------
Fecha : 23/05/2016 13:42 
Error : Can't connect to MySQL server on '192.168.1.6' (10061)
SQL   : SELECT TIEMPO_APAGADO FROM PDV_C_TAQUILLA WHERE ID_TERMINAL = 'AER' AND ID_TAQUILLA = 1000 AND IP = '192.168.56.1'
//------------------------------------------------------------
//------------------------------------------------------------
Fecha : 23/05/2016 17:53 
Error : Can't connect to MySQL server on '192.168.19.15' (10060)
SQL   : SELECT APAGADO FROM PDV_C_TAQUILLA WHERE ID_TERMINAL = 'HTR' AND ID_TAQUILLA = 1000 AND IP = '192.168.56.1' 
//------------------------------------------------------------
//------------------------------------------------------------
Fecha : 23/05/2016 17:53 
Error : Can't connect to MySQL server on '192.168.19.15' (10060)
SQL   : SELECT TIEMPO_APAGADO FROM PDV_C_TAQUILLA WHERE ID_TERMINAL = 'HTR' AND ID_TAQUILLA = 1000 AND IP = '192.168.56.1'
//------------------------------------------------------------
//------------------------------------------------------------
Fecha : 16/06/2016 11:59 
Error : UPDATE command denied to user 'venta'@'192.168.2.203' for table 'PDV_C_TAQUILLA'
SQL   : UPDATE PDV_C_TAQUILLA SET VERSION = '2.0996' WHERE ID_TERMINAL = 'COR' AND  ID_TAQUILLA = '1000' AND IP = '192.168.56.1' 
//------------------------------------------------------------
//------------------------------------------------------------
Fecha : 16/06/2016 12:21 
Error : UPDATE command denied to user 'venta'@'192.168.2.203' for table 'PDV_C_TAQUILLA'
SQL   : UPDATE PDV_C_TAQUILLA SET VERSION = '2.0996' WHERE ID_TERMINAL = 'COR' AND  ID_TAQUILLA = '1000' AND IP = '192.168.56.1' 
//------------------------------------------------------------
//------------------------------------------------------------
Fecha : 16/06/2016 12:47 
Error : UPDATE command denied to user 'venta'@'192.168.2.203' for table 'PDV_C_TAQUILLA'
SQL   : UPDATE PDV_C_TAQUILLA SET VERSION = '2.0996' WHERE ID_TERMINAL = 'COR' AND  ID_TAQUILLA = '1000' AND IP = '192.168.56.1' 
//------------------------------------------------------------
//------------------------------------------------------------
Fecha : 22/06/2016 17:37 
Error : UPDATE command denied to user 'venta'@'192.168.2.203' for table 'PDV_C_TAQUILLA'
SQL   : UPDATE PDV_C_TAQUILLA SET VERSION = '2.0996' WHERE ID_TERMINAL = 'COR' AND  ID_TAQUILLA = '1000' AND IP = '192.168.56.1' 
//------------------------------------------------------------
//------------------------------------------------------------
Fecha : 22/06/2016 17:38 
Error : UPDATE command denied to user 'venta'@'192.168.2.203' for table 'PDV_C_TAQUILLA'
SQL   : UPDATE PDV_C_TAQUILLA SET VERSION = '2.0996' WHERE ID_TERMINAL = 'COR' AND  ID_TAQUILLA = '1000' AND IP = '192.168.56.1' 
//------------------------------------------------------------
//------------------------------------------------------------
Fecha : 28/06/2016 16:01 
Error : Duplicate entry 'AER314-2016-06-28' for key 'PRIMARY'
SQL   : INSERT INTO PDV_C_GUIA_PRECAPTURA(ID_CORRIDA, FECHA, DESTINO, ID_RUTA, NOBUS, OPERADOR) VALUES('AER314', '2016-06-28', 'MEX', 518, 916, TRIM('X2-646'))
//------------------------------------------------------------
//------------------------------------------------------------
Fecha : 28/06/2016 16:01 
Error : Duplicate entry 'AER314-2016-06-28' for key 'PRIMARY'
SQL   : INSERT INTO PDV_C_GUIA_PRECAPTURA(ID_CORRIDA, FECHA, DESTINO, ID_RUTA, NOBUS, OPERADOR) VALUES('AER314', '2016-06-28', 'MEX', 518, 916, TRIM('X2-646'))
//------------------------------------------------------------
//------------------------------------------------------------
Fecha : 28/06/2016 16:09 
Error : Duplicate entry 'AER314-2016-06-28' for key 'PRIMARY'
SQL   : INSERT INTO PDV_C_GUIA_PRECAPTURA(ID_CORRIDA, FECHA, DESTINO, ID_RUTA, NOBUS, OPERADOR) VALUES('AER314', '2016-06-28', 'MEX', 518, 916, TRIM('X2-646'))
//------------------------------------------------------------
//------------------------------------------------------------
Fecha : 28/06/2016 16:11 
Error : Duplicate entry 'AER314-2016-06-28' for key 'PRIMARY'
SQL   : INSERT INTO PDV_C_GUIA_PRECAPTURA(ID_CORRIDA, FECHA, DESTINO, ID_RUTA, NOBUS, OPERADOR) VALUES('AER314', '2016-06-28', 'MEX', 518, 919, TRIM('X2-646'))
//------------------------------------------------------------
//------------------------------------------------------------
Fecha : 29/06/2016 11:18 
Error : Duplicate entry 'AER311-2016-06-29' for key 'PRIMARY'
SQL   : INSERT INTO PDV_C_GUIA_PRECAPTURA(ID_CORRIDA, FECHA, DESTINO, ID_RUTA, NOBUS, OPERADOR) VALUES('AER311', '2016-06-29', 'MEX', 518, 913, TRIM('X2-781'))
//------------------------------------------------------------
//------------------------------------------------------------
Fecha : 29/06/2016 11:24 
Error : Duplicate entry 'AER312-2016-06-29' for key 'PRIMARY'
SQL   : INSERT INTO PDV_C_GUIA_PRECAPTURA(ID_CORRIDA, FECHA, DESTINO, ID_RUTA, NOBUS, OPERADOR) VALUES('AER312', '2016-06-29', 'MEX', 518, 913, TRIM('X2-781'))
//------------------------------------------------------------
//------------------------------------------------------------
Fecha : 29/06/2016 11:26 
Error : Duplicate entry 'AER312-2016-06-29' for key 'PRIMARY'
SQL   : INSERT INTO PDV_C_GUIA_PRECAPTURA(ID_CORRIDA, FECHA, DESTINO, ID_RUTA, NOBUS, OPERADOR) VALUES('AER312', '2016-06-29', 'MEX', 518, 913, TRIM('X2-781'))
//------------------------------------------------------------
//------------------------------------------------------------
Fecha : 29/06/2016 11:27 
Error : Duplicate entry 'AER312-2016-06-29' for key 'PRIMARY'
SQL   : INSERT INTO PDV_C_GUIA_PRECAPTURA(ID_CORRIDA, FECHA, DESTINO, ID_RUTA, NOBUS, OPERADOR) VALUES('AER312', '2016-06-29', 'MEX', 518, 913, TRIM('X2-781'))
//------------------------------------------------------------
//------------------------------------------------------------
Fecha : 29/06/2016 13:35 
Error : Duplicate entry 'AER311-2016-06-29' for key 'PRIMARY'
SQL   : INSERT INTO PDV_C_GUIA_PRECAPTURA(ID_CORRIDA, FECHA, DESTINO, ID_RUTA, NOBUS, OPERADOR) VALUES('AER311', '2016-06-29', 'MEX', 518, 913, TRIM('X2-781'))
//------------------------------------------------------------
//------------------------------------------------------------
Fecha : 29/06/2016 13:37 
Error : Duplicate entry 'AER311-2016-06-29' for key 'PRIMARY'
SQL   : INSERT INTO PDV_C_GUIA_PRECAPTURA(ID_CORRIDA, FECHA, DESTINO, ID_RUTA, NOBUS, OPERADOR) VALUES('AER311', '2016-06-29', 'MEX', 518, 913, TRIM('X2-781'))
//------------------------------------------------------------
//------------------------------------------------------------
Fecha : 29/06/2016 13:40 
Error : Duplicate entry 'AER311-2016-06-29' for key 'PRIMARY'
SQL   : INSERT INTO PDV_C_GUIA_PRECAPTURA(ID_CORRIDA, FECHA, DESTINO, ID_RUTA, NOBUS, OPERADOR) VALUES('AER311', '2016-06-29', 'MEX', 518, 913, TRIM('X2-781'))
//------------------------------------------------------------
//------------------------------------------------------------
Fecha : 29/06/2016 13:52 
Error : Duplicate entry 'AER311-2016-06-29' for key 'PRIMARY'
SQL   : INSERT INTO PDV_C_GUIA_PRECAPTURA(ID_CORRIDA, FECHA, DESTINO, ID_RUTA, NOBUS, OPERADOR) VALUES('AER311', '2016-06-29', 'MEX', 518, 913, TRIM('X2-781'))
//------------------------------------------------------------
//------------------------------------------------------------
Fecha : 29/06/2016 16:37 
Error : Duplicate entry 'AER311-2016-06-29' for key 'PRIMARY'
SQL   : INSERT INTO PDV_C_GUIA_PRECAPTURA(ID_CORRIDA, FECHA, DESTINO, ID_RUTA, NOBUS, OPERADOR) VALUES('AER311', '2016-06-29', 'MEX', 518, 913, TRIM('X2-781'))
//------------------------------------------------------------
//------------------------------------------------------------
Fecha : 29/06/2016 16:39 
Error : Duplicate entry 'AER311-2016-06-29' for key 'PRIMARY'
SQL   : INSERT INTO PDV_C_GUIA_PRECAPTURA(ID_CORRIDA, FECHA, DESTINO, ID_RUTA, NOBUS, OPERADOR) VALUES('AER311', '2016-06-29', 'MEX', 518, 913, TRIM('X2-781'))
//------------------------------------------------------------
//------------------------------------------------------------
Fecha : 29/06/2016 16:54 
Error : Duplicate entry 'AER311-2016-06-29' for key 'PRIMARY'
SQL   : INSERT INTO PDV_C_GUIA_PRECAPTURA(ID_CORRIDA, FECHA, DESTINO, ID_RUTA, NOBUS, OPERADOR) VALUES('AER311', '2016-06-29', 'MEX', 518, 913, TRIM('X2-781'))
//------------------------------------------------------------
//------------------------------------------------------------
Fecha : 29/06/2016 16:56 
Error : Duplicate entry 'AER311-2016-06-29' for key 'PRIMARY'
SQL   : INSERT INTO PDV_C_GUIA_PRECAPTURA(ID_CORRIDA, FECHA, DESTINO, ID_RUTA, NOBUS, OPERADOR) VALUES('AER311', '2016-06-29', 'MEX', 518, 913, TRIM('X2-781'))
//------------------------------------------------------------
//------------------------------------------------------------
Fecha : 29/06/2016 17:04 
Error : Duplicate entry 'AER311-2016-06-29' for key 'PRIMARY'
SQL   : INSERT INTO PDV_C_GUIA_PRECAPTURA(ID_CORRIDA, FECHA, DESTINO, ID_RUTA, NOBUS, OPERADOR) VALUES('AER311', '2016-06-29', 'MEX', 518, 913, TRIM('X2-781'))
//------------------------------------------------------------
//------------------------------------------------------------
Fecha : 29/06/2016 17:52 
Error : Duplicate entry 'AER311-2016-06-29' for key 'PRIMARY'
SQL   : INSERT INTO PDV_C_GUIA_PRECAPTURA(ID_CORRIDA, FECHA, DESTINO, ID_RUTA, NOBUS, OPERADOR) VALUES('AER311', '2016-06-29', 'MEX', 518, 913, TRIM('X2-781'))
//------------------------------------------------------------
//------------------------------------------------------------
Fecha : 29/06/2016 17:53 
Error : Duplicate entry 'AER311-2016-06-29' for key 'PRIMARY'
SQL   : INSERT INTO PDV_C_GUIA_PRECAPTURA(ID_CORRIDA, FECHA, DESTINO, ID_RUTA, NOBUS, OPERADOR) VALUES('AER311', '2016-06-29', 'MEX', 518, 913, TRIM('X2-781'))
//------------------------------------------------------------
//------------------------------------------------------------
Fecha : 29/06/2016 17:59 
Error : Duplicate entry 'AER311-2016-06-29' for key 'PRIMARY'
SQL   : INSERT INTO PDV_C_GUIA_PRECAPTURA(ID_CORRIDA, FECHA, DESTINO, ID_RUTA, NOBUS, OPERADOR) VALUES('AER311', '2016-06-29', 'MEX', 518, 913, TRIM('X2-781'))
//------------------------------------------------------------
//------------------------------------------------------------
Fecha : 29/06/2016 18:05 
Error : Duplicate entry 'AER311-2016-06-29' for key 'PRIMARY'
SQL   : INSERT INTO PDV_C_GUIA_PRECAPTURA(ID_CORRIDA, FECHA, DESTINO, ID_RUTA, NOBUS, OPERADOR) VALUES('AER311', '2016-06-29', 'MEX', 518, 913, TRIM('X2-781'))
//------------------------------------------------------------
//------------------------------------------------------------
Fecha : 29/06/2016 18:07 
Error : Duplicate entry 'AER311-2016-06-29' for key 'PRIMARY'
SQL   : INSERT INTO PDV_C_GUIA_PRECAPTURA(ID_CORRIDA, FECHA, DESTINO, ID_RUTA, NOBUS, OPERADOR) VALUES('AER311', '2016-06-29', 'MEX', 518, 913, TRIM('X2-781'))
//------------------------------------------------------------
//------------------------------------------------------------
Fecha : 29/06/2016 18:08 
Error : Duplicate entry 'AER311-2016-06-29' for key 'PRIMARY'
SQL   : INSERT INTO PDV_C_GUIA_PRECAPTURA(ID_CORRIDA, FECHA, DESTINO, ID_RUTA, NOBUS, OPERADOR) VALUES('AER311', '2016-06-29', 'MEX', 518, 913, TRIM('X2-781'))
//------------------------------------------------------------
//------------------------------------------------------------
Fecha : 29/06/2016 18:09 
Error : Duplicate entry 'AER311-2016-06-29' for key 'PRIMARY'
SQL   : INSERT INTO PDV_C_GUIA_PRECAPTURA(ID_CORRIDA, FECHA, DESTINO, ID_RUTA, NOBUS, OPERADOR) VALUES('AER311', '2016-06-29', 'MEX', 518, 913, TRIM('X2-781'))
//------------------------------------------------------------
//------------------------------------------------------------
Fecha : 29/06/2016 18:10 
Error : Duplicate entry 'AER311-2016-06-29' for key 'PRIMARY'
SQL   : INSERT INTO PDV_C_GUIA_PRECAPTURA(ID_CORRIDA, FECHA, DESTINO, ID_RUTA, NOBUS, OPERADOR) VALUES('AER311', '2016-06-29', 'MEX', 518, 913, TRIM('X2-781'))
//------------------------------------------------------------
//------------------------------------------------------------
Fecha : 29/06/2016 18:12 
Error : Duplicate entry 'AER311-2016-06-29' for key 'PRIMARY'
SQL   : INSERT INTO PDV_C_GUIA_PRECAPTURA(ID_CORRIDA, FECHA, DESTINO, ID_RUTA, NOBUS, OPERADOR) VALUES('AER311', '2016-06-29', 'MEX', 518, 913, TRIM('X2-781'))
//------------------------------------------------------------
//------------------------------------------------------------
Fecha : 30/06/2016 10:20 
Error : Duplicate entry 'AER311-2016-06-30' for key 'PRIMARY'
SQL   : INSERT INTO PDV_C_GUIA_PRECAPTURA(ID_CORRIDA, FECHA, DESTINO, ID_RUTA, NOBUS, OPERADOR) VALUES('AER311', '2016-06-30', 'MEX', 518, 913, TRIM('X2-797'))
//------------------------------------------------------------
//------------------------------------------------------------
Fecha : 30/06/2016 10:25 
Error : Duplicate entry 'AER311-2016-06-30' for key 'PRIMARY'
SQL   : INSERT INTO PDV_C_GUIA_PRECAPTURA(ID_CORRIDA, FECHA, DESTINO, ID_RUTA, NOBUS, OPERADOR) VALUES('AER311', '2016-06-30', 'MEX', 518, 914, TRIM('X2-797'))
//------------------------------------------------------------
//------------------------------------------------------------
Fecha : 30/06/2016 10:26 
Error : Duplicate entry 'AER311-2016-06-30' for key 'PRIMARY'
SQL   : INSERT INTO PDV_C_GUIA_PRECAPTURA(ID_CORRIDA, FECHA, DESTINO, ID_RUTA, NOBUS, OPERADOR) VALUES('AER311', '2016-06-30', 'MEX', 518, 914, TRIM('X2-797'))
//------------------------------------------------------------
//------------------------------------------------------------
Fecha : 30/06/2016 10:28 
Error : Duplicate entry 'AER311-2016-06-30' for key 'PRIMARY'
SQL   : INSERT INTO PDV_C_GUIA_PRECAPTURA(ID_CORRIDA, FECHA, DESTINO, ID_RUTA, NOBUS, OPERADOR) VALUES('AER311', '2016-06-30', 'MEX', 518, 914, TRIM('X2-797'))
//------------------------------------------------------------
//------------------------------------------------------------
Fecha : 30/06/2016 10:34 
Error : Duplicate entry 'AER311-2016-06-30' for key 'PRIMARY'
SQL   : INSERT INTO PDV_C_GUIA_PRECAPTURA(ID_CORRIDA, FECHA, DESTINO, ID_RUTA, NOBUS, OPERADOR) VALUES('AER311', '2016-06-30', 'MEX', 518, 914, TRIM('X2-797'))
//------------------------------------------------------------
//------------------------------------------------------------
Fecha : 30/06/2016 10:34 
Error : Duplicate entry 'AER311-2016-06-30' for key 'PRIMARY'
SQL   : INSERT INTO PDV_C_GUIA_PRECAPTURA(ID_CORRIDA, FECHA, DESTINO, ID_RUTA, NOBUS, OPERADOR) VALUES('AER311', '2016-06-30', 'MEX', 518, 914, TRIM('X2-797'))
//------------------------------------------------------------
//------------------------------------------------------------
Fecha : 30/06/2016 10:45 
Error : Duplicate entry 'AER311-2016-06-30' for key 'PRIMARY'
SQL   : INSERT INTO PDV_C_GUIA_PRECAPTURA(ID_CORRIDA, FECHA, DESTINO, ID_RUTA, NOBUS, OPERADOR) VALUES('AER311', '2016-06-30', 'MEX', 518, 914, TRIM('X2-797'))
//------------------------------------------------------------
//------------------------------------------------------------
Fecha : 30/06/2016 10:46 
Error : Duplicate entry 'AER311-2016-06-30' for key 'PRIMARY'
SQL   : INSERT INTO PDV_C_GUIA_PRECAPTURA(ID_CORRIDA, FECHA, DESTINO, ID_RUTA, NOBUS, OPERADOR) VALUES('AER311', '2016-06-30', 'MEX', 518, 914, TRIM('X2-797'))
//------------------------------------------------------------
//------------------------------------------------------------
Fecha : 30/06/2016 10:58 
Error : Duplicate entry 'AER311-2016-06-30' for key 'PRIMARY'
SQL   : INSERT INTO PDV_C_GUIA_PRECAPTURA(ID_CORRIDA, FECHA, DESTINO, ID_RUTA, NOBUS, OPERADOR) VALUES('AER311', '2016-06-30', 'MEX', 518, 914, TRIM('X2-797'))
//------------------------------------------------------------
//------------------------------------------------------------
Fecha : 30/06/2016 11:00 
Error : Duplicate entry 'AER311-2016-06-30' for key 'PRIMARY'
SQL   : INSERT INTO PDV_C_GUIA_PRECAPTURA(ID_CORRIDA, FECHA, DESTINO, ID_RUTA, NOBUS, OPERADOR) VALUES('AER311', '2016-06-30', 'MEX', 518, 914, TRIM('X2-797'))
//------------------------------------------------------------
//------------------------------------------------------------
Fecha : 30/06/2016 11:04 
Error : Duplicate entry 'AER311-2016-06-30' for key 'PRIMARY'
SQL   : INSERT INTO PDV_C_GUIA_PRECAPTURA(ID_CORRIDA, FECHA, DESTINO, ID_RUTA, NOBUS, OPERADOR) VALUES('AER311', '2016-06-30', 'MEX', 518, 914, TRIM('X2-797'))
//------------------------------------------------------------
//------------------------------------------------------------
Fecha : 30/06/2016 11:08 
Error : Duplicate entry 'AER311-2016-06-30' for key 'PRIMARY'
SQL   : INSERT INTO PDV_C_GUIA_PRECAPTURA(ID_CORRIDA, FECHA, DESTINO, ID_RUTA, NOBUS, OPERADOR) VALUES('AER311', '2016-06-30', 'MEX', 518, 914, TRIM('X2-797'))
//------------------------------------------------------------
//------------------------------------------------------------
Fecha : 30/06/2016 11:12 
Error : Duplicate entry 'AER311-2016-06-30' for key 'PRIMARY'
SQL   : INSERT INTO PDV_C_GUIA_PRECAPTURA(ID_CORRIDA, FECHA, DESTINO, ID_RUTA, NOBUS, OPERADOR) VALUES('AER311', '2016-06-30', 'MEX', 518, 914, TRIM('X2-797'))
//------------------------------------------------------------
//------------------------------------------------------------
Fecha : 30/06/2016 11:12 
Error : Duplicate entry 'AER311-2016-06-30' for key 'PRIMARY'
SQL   : INSERT INTO PDV_C_GUIA_PRECAPTURA(ID_CORRIDA, FECHA, DESTINO, ID_RUTA, NOBUS, OPERADOR) VALUES('AER311', '2016-06-30', 'MEX', 518, 914, TRIM('X2-797'))
//------------------------------------------------------------
//------------------------------------------------------------
Fecha : 30/06/2016 11:14 
Error : Duplicate entry 'AER311-2016-06-30' for key 'PRIMARY'
SQL   : INSERT INTO PDV_C_GUIA_PRECAPTURA(ID_CORRIDA, FECHA, DESTINO, ID_RUTA, NOBUS, OPERADOR) VALUES('AER311', '2016-06-30', 'MEX', 518, 914, TRIM('X2-797'))
//------------------------------------------------------------
//------------------------------------------------------------
Fecha : 30/06/2016 11:16 
Error : Duplicate entry 'AER311-2016-06-30' for key 'PRIMARY'
SQL   : INSERT INTO PDV_C_GUIA_PRECAPTURA(ID_CORRIDA, FECHA, DESTINO, ID_RUTA, NOBUS, OPERADOR) VALUES('AER311', '2016-06-30', 'MEX', 518, 914, TRIM('X2-797'))
//------------------------------------------------------------
//------------------------------------------------------------
Fecha : 30/06/2016 11:17 
Error : Duplicate entry 'AER311-2016-06-30' for key 'PRIMARY'
SQL   : INSERT INTO PDV_C_GUIA_PRECAPTURA(ID_CORRIDA, FECHA, DESTINO, ID_RUTA, NOBUS, OPERADOR) VALUES('AER311', '2016-06-30', 'MEX', 518, 914, TRIM('X2-797'))
//------------------------------------------------------------
//------------------------------------------------------------
Fecha : 30/06/2016 11:18 
Error : Duplicate entry 'AER311-2016-06-30' for key 'PRIMARY'
SQL   : INSERT INTO PDV_C_GUIA_PRECAPTURA(ID_CORRIDA, FECHA, DESTINO, ID_RUTA, NOBUS, OPERADOR) VALUES('AER311', '2016-06-30', 'MEX', 518, 914, TRIM('X2-797'))
//------------------------------------------------------------
//------------------------------------------------------------
Fecha : 30/06/2016 11:20 
Error : Duplicate entry 'AER311-2016-06-30' for key 'PRIMARY'
SQL   : INSERT INTO PDV_C_GUIA_PRECAPTURA(ID_CORRIDA, FECHA, DESTINO, ID_RUTA, NOBUS, OPERADOR) VALUES('AER311', '2016-06-30', 'MEX', 518, 914, TRIM('X2-797'))
//------------------------------------------------------------
//------------------------------------------------------------
Fecha : 30/06/2016 11:21 
Error : Duplicate entry 'AER311-2016-06-30' for key 'PRIMARY'
SQL   : INSERT INTO PDV_C_GUIA_PRECAPTURA(ID_CORRIDA, FECHA, DESTINO, ID_RUTA, NOBUS, OPERADOR) VALUES('AER311', '2016-06-30', 'MEX', 518, 914, TRIM('X2-797'))
//------------------------------------------------------------
//------------------------------------------------------------
Fecha : 30/06/2016 11:24 
Error : Duplicate entry 'AER311-2016-06-30' for key 'PRIMARY'
SQL   : INSERT INTO PDV_C_GUIA_PRECAPTURA(ID_CORRIDA, FECHA, DESTINO, ID_RUTA, NOBUS, OPERADOR) VALUES('AER311', '2016-06-30', 'MEX', 518, 914, TRIM('X2-797'))
//------------------------------------------------------------
//------------------------------------------------------------
Fecha : 30/06/2016 11:28 
Error : Duplicate entry 'AER311-2016-06-30' for key 'PRIMARY'
SQL   : INSERT INTO PDV_C_GUIA_PRECAPTURA(ID_CORRIDA, FECHA, DESTINO, ID_RUTA, NOBUS, OPERADOR) VALUES('AER311', '2016-06-30', 'MEX', 518, 914, TRIM('X2-797'))
//------------------------------------------------------------
//------------------------------------------------------------
Fecha : 30/06/2016 11:39 
Error : Duplicate entry 'AER311-2016-06-30' for key 'PRIMARY'
SQL   : INSERT INTO PDV_C_GUIA_PRECAPTURA(ID_CORRIDA, FECHA, DESTINO, ID_RUTA, NOBUS, OPERADOR) VALUES('AER311', '2016-06-30', 'MEX', 518, 914, TRIM('X2-797'))
//------------------------------------------------------------
//------------------------------------------------------------
Fecha : 30/06/2016 11:39 
Error : Duplicate entry 'AER311-2016-06-30' for key 'PRIMARY'
SQL   : INSERT INTO PDV_C_GUIA_PRECAPTURA(ID_CORRIDA, FECHA, DESTINO, ID_RUTA, NOBUS, OPERADOR) VALUES('AER311', '2016-06-30', 'MEX', 518, 914, TRIM('X2-797'))
//------------------------------------------------------------
//------------------------------------------------------------
Fecha : 30/06/2016 11:43 
Error : Duplicate entry 'AER311-2016-06-30' for key 'PRIMARY'
SQL   : INSERT INTO PDV_C_GUIA_PRECAPTURA(ID_CORRIDA, FECHA, DESTINO, ID_RUTA, NOBUS, OPERADOR) VALUES('AER311', '2016-06-30', 'MEX', 518, 914, TRIM('X2-797'))
//------------------------------------------------------------
//------------------------------------------------------------
Fecha : 30/06/2016 11:44 
Error : Duplicate entry 'AER311-2016-06-30' for key 'PRIMARY'
SQL   : INSERT INTO PDV_C_GUIA_PRECAPTURA(ID_CORRIDA, FECHA, DESTINO, ID_RUTA, NOBUS, OPERADOR) VALUES('AER311', '2016-06-30', 'MEX', 518, 914, TRIM('X2-797'))
//------------------------------------------------------------
//------------------------------------------------------------
Fecha : 30/06/2016 11:44 
Error : Duplicate entry 'AER311-2016-06-30' for key 'PRIMARY'
SQL   : INSERT INTO PDV_C_GUIA_PRECAPTURA(ID_CORRIDA, FECHA, DESTINO, ID_RUTA, NOBUS, OPERADOR) VALUES('AER311', '2016-06-30', 'MEX', 518, 914, TRIM('X2-797'))
//------------------------------------------------------------
//------------------------------------------------------------
Fecha : 30/06/2016 11:45 
Error : Duplicate entry 'AER311-2016-06-30' for key 'PRIMARY'
SQL   : INSERT INTO PDV_C_GUIA_PRECAPTURA(ID_CORRIDA, FECHA, DESTINO, ID_RUTA, NOBUS, OPERADOR) VALUES('AER311', '2016-06-30', 'MEX', 518, 914, TRIM('X2-797'))
//------------------------------------------------------------
//------------------------------------------------------------
Fecha : 30/06/2016 11:46 
Error : Duplicate entry 'AER311-2016-06-30' for key 'PRIMARY'
SQL   : INSERT INTO PDV_C_GUIA_PRECAPTURA(ID_CORRIDA, FECHA, DESTINO, ID_RUTA, NOBUS, OPERADOR) VALUES('AER311', '2016-06-30', 'MEX', 518, 914, TRIM('X2-797'))
//------------------------------------------------------------
//------------------------------------------------------------
Fecha : 30/06/2016 11:47 
Error : Duplicate entry 'AER311-2016-06-30' for key 'PRIMARY'
SQL   : INSERT INTO PDV_C_GUIA_PRECAPTURA(ID_CORRIDA, FECHA, DESTINO, ID_RUTA, NOBUS, OPERADOR) VALUES('AER311', '2016-06-30', 'MEX', 518, 914, TRIM('X2-797'))
//------------------------------------------------------------
//------------------------------------------------------------
Fecha : 30/06/2016 11:48 
Error : Duplicate entry 'AER311-2016-06-30' for key 'PRIMARY'
SQL   : INSERT INTO PDV_C_GUIA_PRECAPTURA(ID_CORRIDA, FECHA, DESTINO, ID_RUTA, NOBUS, OPERADOR) VALUES('AER311', '2016-06-30', 'MEX', 518, 914, TRIM('X2-797'))
//------------------------------------------------------------
//------------------------------------------------------------
Fecha : 30/06/2016 11:50 
Error : Duplicate entry 'AER311-2016-06-30' for key 'PRIMARY'
SQL   : INSERT INTO PDV_C_GUIA_PRECAPTURA(ID_CORRIDA, FECHA, DESTINO, ID_RUTA, NOBUS, OPERADOR) VALUES('AER311', '2016-06-30', 'MEX', 518, 914, TRIM('X2-797'))
//------------------------------------------------------------
//------------------------------------------------------------
Fecha : 30/06/2016 12:20 
Error : Duplicate entry 'AER311-2016-06-30' for key 'PRIMARY'
SQL   : INSERT INTO PDV_C_GUIA_PRECAPTURA(ID_CORRIDA, FECHA, DESTINO, ID_RUTA, NOBUS, OPERADOR) VALUES('AER311', '2016-06-30', 'MEX', 518, 914, TRIM('X2-797'))
//------------------------------------------------------------
//------------------------------------------------------------
Fecha : 30/06/2016 12:49 
Error : Duplicate entry 'AER311-2016-06-30' for key 'PRIMARY'
SQL   : INSERT INTO PDV_C_GUIA_PRECAPTURA(ID_CORRIDA, FECHA, DESTINO, ID_RUTA, NOBUS, OPERADOR) VALUES('AER311', '2016-06-30', 'MEX', 518, 914, TRIM('X2-797'))
//------------------------------------------------------------
//------------------------------------------------------------
Fecha : 30/06/2016 12:52 
Error : Duplicate entry 'AER311-2016-06-30' for key 'PRIMARY'
SQL   : INSERT INTO PDV_C_GUIA_PRECAPTURA(ID_CORRIDA, FECHA, DESTINO, ID_RUTA, NOBUS, OPERADOR) VALUES('AER311', '2016-06-30', 'MEX', 518, 914, TRIM('X2-797'))
//------------------------------------------------------------
//------------------------------------------------------------
Fecha : 30/06/2016 12:59 
Error : Duplicate entry 'AER311-2016-06-30' for key 'PRIMARY'
SQL   : INSERT INTO PDV_C_GUIA_PRECAPTURA(ID_CORRIDA, FECHA, DESTINO, ID_RUTA, NOBUS, OPERADOR) VALUES('AER311', '2016-06-30', 'MEX', 518, 914, TRIM('X2-797'))
//------------------------------------------------------------
//------------------------------------------------------------
Fecha : 30/06/2016 13:03 
Error : Duplicate entry 'AER311-2016-06-30' for key 'PRIMARY'
SQL   : INSERT INTO PDV_C_GUIA_PRECAPTURA(ID_CORRIDA, FECHA, DESTINO, ID_RUTA, NOBUS, OPERADOR) VALUES('AER311', '2016-06-30', 'MEX', 518, 914, TRIM('X2-797'))
//------------------------------------------------------------
//------------------------------------------------------------
Fecha : 30/06/2016 13:11 
Error : Duplicate entry 'AER311-2016-06-30' for key 'PRIMARY'
SQL   : INSERT INTO PDV_C_GUIA_PRECAPTURA(ID_CORRIDA, FECHA, DESTINO, ID_RUTA, NOBUS, OPERADOR) VALUES('AER311', '2016-06-30', 'MEX', 518, 914, TRIM('X2-797'))
//------------------------------------------------------------
//------------------------------------------------------------
Fecha : 30/06/2016 13:12 
Error : Duplicate entry 'AER311-2016-06-30' for key 'PRIMARY'
SQL   : INSERT INTO PDV_C_GUIA_PRECAPTURA(ID_CORRIDA, FECHA, DESTINO, ID_RUTA, NOBUS, OPERADOR) VALUES('AER311', '2016-06-30', 'MEX', 518, 914, TRIM('X2-797'))
//------------------------------------------------------------
//------------------------------------------------------------
Fecha : 30/06/2016 13:16 
Error : Duplicate entry 'AER311-2016-06-30' for key 'PRIMARY'
SQL   : INSERT INTO PDV_C_GUIA_PRECAPTURA(ID_CORRIDA, FECHA, DESTINO, ID_RUTA, NOBUS, OPERADOR) VALUES('AER311', '2016-06-30', 'MEX', 518, 914, TRIM('X2-797'))
//------------------------------------------------------------
//------------------------------------------------------------
Fecha : 30/06/2016 13:17 
Error : Duplicate entry 'AER311-2016-06-30' for key 'PRIMARY'
SQL   : INSERT INTO PDV_C_GUIA_PRECAPTURA(ID_CORRIDA, FECHA, DESTINO, ID_RUTA, NOBUS, OPERADOR) VALUES('AER311', '2016-06-30', 'MEX', 518, 914, TRIM('X2-797'))
//------------------------------------------------------------
//------------------------------------------------------------
Fecha : 30/06/2016 13:18 
Error : Duplicate entry 'AER311-2016-06-30' for key 'PRIMARY'
SQL   : INSERT INTO PDV_C_GUIA_PRECAPTURA(ID_CORRIDA, FECHA, DESTINO, ID_RUTA, NOBUS, OPERADOR) VALUES('AER311', '2016-06-30', 'MEX', 518, 914, TRIM('X2-797'))
//------------------------------------------------------------
//------------------------------------------------------------
Fecha : 30/06/2016 13:23 
Error : Duplicate entry 'AER311-2016-06-30' for key 'PRIMARY'
SQL   : INSERT INTO PDV_C_GUIA_PRECAPTURA(ID_CORRIDA, FECHA, DESTINO, ID_RUTA, NOBUS, OPERADOR) VALUES('AER311', '2016-06-30', 'MEX', 518, 914, TRIM('X2-797'))
//------------------------------------------------------------
//------------------------------------------------------------
Fecha : 30/06/2016 13:24 
Error : Duplicate entry 'AER311-2016-06-30' for key 'PRIMARY'
SQL   : INSERT INTO PDV_C_GUIA_PRECAPTURA(ID_CORRIDA, FECHA, DESTINO, ID_RUTA, NOBUS, OPERADOR) VALUES('AER311', '2016-06-30', 'MEX', 518, 914, TRIM('X2-797'))
//------------------------------------------------------------
//------------------------------------------------------------
Fecha : 30/06/2016 13:25 
Error : Duplicate entry 'AER311-2016-06-30' for key 'PRIMARY'
SQL   : INSERT INTO PDV_C_GUIA_PRECAPTURA(ID_CORRIDA, FECHA, DESTINO, ID_RUTA, NOBUS, OPERADOR) VALUES('AER311', '2016-06-30', 'MEX', 518, 914, TRIM('X2-797'))
//------------------------------------------------------------
//------------------------------------------------------------
Fecha : 30/06/2016 13:26 
Error : Duplicate entry 'AER311-2016-06-30' for key 'PRIMARY'
SQL   : INSERT INTO PDV_C_GUIA_PRECAPTURA(ID_CORRIDA, FECHA, DESTINO, ID_RUTA, NOBUS, OPERADOR) VALUES('AER311', '2016-06-30', 'MEX', 518, 914, TRIM('X2-797'))
//------------------------------------------------------------
//------------------------------------------------------------
Fecha : 30/06/2016 13:27 
Error : Duplicate entry 'AER311-2016-06-30' for key 'PRIMARY'
SQL   : INSERT INTO PDV_C_GUIA_PRECAPTURA(ID_CORRIDA, FECHA, DESTINO, ID_RUTA, NOBUS, OPERADOR) VALUES('AER311', '2016-06-30', 'MEX', 518, 914, TRIM('X2-797'))
//------------------------------------------------------------
//------------------------------------------------------------
Fecha : 30/06/2016 13:28 
Error : Duplicate entry 'AER311-2016-06-30' for key 'PRIMARY'
SQL   : INSERT INTO PDV_C_GUIA_PRECAPTURA(ID_CORRIDA, FECHA, DESTINO, ID_RUTA, NOBUS, OPERADOR) VALUES('AER311', '2016-06-30', 'MEX', 518, 914, TRIM('X2-797'))
//------------------------------------------------------------
//------------------------------------------------------------
Fecha : 30/06/2016 13:29 
Error : Duplicate entry 'AER311-2016-06-30' for key 'PRIMARY'
SQL   : INSERT INTO PDV_C_GUIA_PRECAPTURA(ID_CORRIDA, FECHA, DESTINO, ID_RUTA, NOBUS, OPERADOR) VALUES('AER311', '2016-06-30', 'MEX', 518, 914, TRIM('X2-797'))
//------------------------------------------------------------
//------------------------------------------------------------
Fecha : 30/06/2016 13:29 
Error : Duplicate entry 'AER311-2016-06-30' for key 'PRIMARY'
SQL   : INSERT INTO PDV_C_GUIA_PRECAPTURA(ID_CORRIDA, FECHA, DESTINO, ID_RUTA, NOBUS, OPERADOR) VALUES('AER311', '2016-06-30', 'MEX', 518, 914, TRIM('X2-797'))
//------------------------------------------------------------
//------------------------------------------------------------
Fecha : 30/06/2016 13:30 
Error : Duplicate entry 'AER311-2016-06-30' for key 'PRIMARY'
SQL   : INSERT INTO PDV_C_GUIA_PRECAPTURA(ID_CORRIDA, FECHA, DESTINO, ID_RUTA, NOBUS, OPERADOR) VALUES('AER311', '2016-06-30', 'MEX', 518, 914, TRIM('X2-797'))
//------------------------------------------------------------
//------------------------------------------------------------
Fecha : 30/06/2016 13:52 
Error : Duplicate entry 'AER311-2016-06-30' for key 'PRIMARY'
SQL   : INSERT INTO PDV_C_GUIA_PRECAPTURA(ID_CORRIDA, FECHA, DESTINO, ID_RUTA, NOBUS, OPERADOR) VALUES('AER311', '2016-06-30', 'MEX', 518, 914, TRIM('X2-797'))
//------------------------------------------------------------
//------------------------------------------------------------
Fecha : 30/06/2016 13:55 
Error : Duplicate entry 'AER311-2016-06-30' for key 'PRIMARY'
SQL   : INSERT INTO PDV_C_GUIA_PRECAPTURA(ID_CORRIDA, FECHA, DESTINO, ID_RUTA, NOBUS, OPERADOR) VALUES('AER311', '2016-06-30', 'MEX', 518, 914, TRIM('X2-797'))
//------------------------------------------------------------
//------------------------------------------------------------
Fecha : 30/06/2016 13:56 
Error : Duplicate entry 'AER311-2016-06-30' for key 'PRIMARY'
SQL   : INSERT INTO PDV_C_GUIA_PRECAPTURA(ID_CORRIDA, FECHA, DESTINO, ID_RUTA, NOBUS, OPERADOR) VALUES('AER311', '2016-06-30', 'MEX', 518, 914, TRIM('X2-797'))
//------------------------------------------------------------
//------------------------------------------------------------
Fecha : 30/06/2016 13:57 
Error : Duplicate entry 'AER311-2016-06-30' for key 'PRIMARY'
SQL   : INSERT INTO PDV_C_GUIA_PRECAPTURA(ID_CORRIDA, FECHA, DESTINO, ID_RUTA, NOBUS, OPERADOR) VALUES('AER311', '2016-06-30', 'MEX', 518, 914, TRIM('X2-797'))
//------------------------------------------------------------
//------------------------------------------------------------
Fecha : 30/06/2016 13:58 
Error : Duplicate entry 'AER311-2016-06-30' for key 'PRIMARY'
SQL   : INSERT INTO PDV_C_GUIA_PRECAPTURA(ID_CORRIDA, FECHA, DESTINO, ID_RUTA, NOBUS, OPERADOR) VALUES('AER311', '2016-06-30', 'MEX', 518, 914, TRIM('X2-797'))
//------------------------------------------------------------
//------------------------------------------------------------
Fecha : 30/06/2016 13:59 
Error : Duplicate entry 'AER311-2016-06-30' for key 'PRIMARY'
SQL   : INSERT INTO PDV_C_GUIA_PRECAPTURA(ID_CORRIDA, FECHA, DESTINO, ID_RUTA, NOBUS, OPERADOR) VALUES('AER311', '2016-06-30', 'MEX', 518, 914, TRIM('X2-797'))
//------------------------------------------------------------
//------------------------------------------------------------
Fecha : 30/06/2016 14:00 
Error : Duplicate entry 'AER311-2016-06-30' for key 'PRIMARY'
SQL   : INSERT INTO PDV_C_GUIA_PRECAPTURA(ID_CORRIDA, FECHA, DESTINO, ID_RUTA, NOBUS, OPERADOR) VALUES('AER311', '2016-06-30', 'MEX', 518, 914, TRIM('X2-797'))
//------------------------------------------------------------
//------------------------------------------------------------
Fecha : 30/06/2016 14:00 
Error : Duplicate entry 'AER311-2016-06-30' for key 'PRIMARY'
SQL   : INSERT INTO PDV_C_GUIA_PRECAPTURA(ID_CORRIDA, FECHA, DESTINO, ID_RUTA, NOBUS, OPERADOR) VALUES('AER311', '2016-06-30', 'MEX', 518, 914, TRIM('X2-797'))
//------------------------------------------------------------
//------------------------------------------------------------
Fecha : 30/06/2016 14:21 
Error : Duplicate entry 'AER311-2016-06-30' for key 'PRIMARY'
SQL   : INSERT INTO PDV_C_GUIA_PRECAPTURA(ID_CORRIDA, FECHA, DESTINO, ID_RUTA, NOBUS, OPERADOR) VALUES('AER311', '2016-06-30', 'MEX', 518, 914, TRIM('X2-797'))
//------------------------------------------------------------
//------------------------------------------------------------
Fecha : 30/06/2016 14:22 
Error : Duplicate entry 'AER311-2016-06-30' for key 'PRIMARY'
SQL   : INSERT INTO PDV_C_GUIA_PRECAPTURA(ID_CORRIDA, FECHA, DESTINO, ID_RUTA, NOBUS, OPERADOR) VALUES('AER311', '2016-06-30', 'MEX', 518, 914, TRIM('X2-797'))
//------------------------------------------------------------
//------------------------------------------------------------
Fecha : 30/06/2016 14:23 
Error : Duplicate entry 'AER311-2016-06-30' for key 'PRIMARY'
SQL   : INSERT INTO PDV_C_GUIA_PRECAPTURA(ID_CORRIDA, FECHA, DESTINO, ID_RUTA, NOBUS, OPERADOR) VALUES('AER311', '2016-06-30', 'MEX', 518, 914, TRIM('X2-797'))
//------------------------------------------------------------
//------------------------------------------------------------
Fecha : 30/06/2016 14:38 
Error : Duplicate entry 'AER311-2016-06-30' for key 'PRIMARY'
SQL   : INSERT INTO PDV_C_GUIA_PRECAPTURA(ID_CORRIDA, FECHA, DESTINO, ID_RUTA, NOBUS, OPERADOR) VALUES('AER311', '2016-06-30', 'MEX', 518, 914, TRIM('X2-797'))
//------------------------------------------------------------
//------------------------------------------------------------
Fecha : 30/06/2016 14:40 
Error : Duplicate entry 'AER311-2016-06-30' for key 'PRIMARY'
SQL   : INSERT INTO PDV_C_GUIA_PRECAPTURA(ID_CORRIDA, FECHA, DESTINO, ID_RUTA, NOBUS, OPERADOR) VALUES('AER311', '2016-06-30', 'MEX', 518, 914, TRIM('X2-797'))
//------------------------------------------------------------
//------------------------------------------------------------
Fecha : 30/06/2016 16:52 
Error : Duplicate entry 'AER311-2016-06-30' for key 'PRIMARY'
SQL   : INSERT INTO PDV_C_GUIA_PRECAPTURA(ID_CORRIDA, FECHA, DESTINO, ID_RUTA, NOBUS, OPERADOR) VALUES('AER311', '2016-06-30', 'MEX', 518, 914, TRIM('X2-797'))
//------------------------------------------------------------
//------------------------------------------------------------
Fecha : 30/06/2016 16:58 
Error : Duplicate entry 'AER311-2016-06-30' for key 'PRIMARY'
SQL   : INSERT INTO PDV_C_GUIA_PRECAPTURA(ID_CORRIDA, FECHA, DESTINO, ID_RUTA, NOBUS, OPERADOR) VALUES('AER311', '2016-06-30', 'MEX', 518, 914, TRIM('X2-797'))
//------------------------------------------------------------
//------------------------------------------------------------
Fecha : 30/06/2016 17:00 
Error : Duplicate entry 'AER311-2016-06-30' for key 'PRIMARY'
SQL   : INSERT INTO PDV_C_GUIA_PRECAPTURA(ID_CORRIDA, FECHA, DESTINO, ID_RUTA, NOBUS, OPERADOR) VALUES('AER311', '2016-06-30', 'MEX', 518, 914, TRIM('X2-797'))
//------------------------------------------------------------
//------------------------------------------------------------
Fecha : 30/06/2016 17:01 
Error : Duplicate entry 'AER311-2016-06-30' for key 'PRIMARY'
SQL   : INSERT INTO PDV_C_GUIA_PRECAPTURA(ID_CORRIDA, FECHA, DESTINO, ID_RUTA, NOBUS, OPERADOR) VALUES('AER311', '2016-06-30', 'MEX', 518, 914, TRIM('X2-797'))
//------------------------------------------------------------
//------------------------------------------------------------
Fecha : 30/06/2016 17:08 
Error : Duplicate entry 'AER311-2016-06-30' for key 'PRIMARY'
SQL   : INSERT INTO PDV_C_GUIA_PRECAPTURA(ID_CORRIDA, FECHA, DESTINO, ID_RUTA, NOBUS, OPERADOR) VALUES('AER311', '2016-06-30', 'MEX', 518, 914, TRIM('X2-797'))
//------------------------------------------------------------
//------------------------------------------------------------
Fecha : 30/06/2016 17:10 
Error : Duplicate entry 'AER311-2016-06-30' for key 'PRIMARY'
SQL   : INSERT INTO PDV_C_GUIA_PRECAPTURA(ID_CORRIDA, FECHA, DESTINO, ID_RUTA, NOBUS, OPERADOR) VALUES('AER311', '2016-06-30', 'MEX', 518, 914, TRIM('X2-797'))
//------------------------------------------------------------
//------------------------------------------------------------
Fecha : 30/06/2016 17:17 
Error : Duplicate entry 'AER311-2016-06-30' for key 'PRIMARY'
SQL   : INSERT INTO PDV_C_GUIA_PRECAPTURA(ID_CORRIDA, FECHA, DESTINO, ID_RUTA, NOBUS, OPERADOR) VALUES('AER311', '2016-06-30', 'MEX', 518, 914, TRIM('X2-797'))
//------------------------------------------------------------
//------------------------------------------------------------
Fecha : 30/06/2016 17:19 
Error : Duplicate entry 'AER311-2016-06-30' for key 'PRIMARY'
SQL   : INSERT INTO PDV_C_GUIA_PRECAPTURA(ID_CORRIDA, FECHA, DESTINO, ID_RUTA, NOBUS, OPERADOR) VALUES('AER311', '2016-06-30', 'MEX', 518, 914, TRIM('X2-797'))
//------------------------------------------------------------
//------------------------------------------------------------
Fecha : 30/06/2016 17:23 
Error : Duplicate entry 'AER311-2016-06-30' for key 'PRIMARY'
SQL   : INSERT INTO PDV_C_GUIA_PRECAPTURA(ID_CORRIDA, FECHA, DESTINO, ID_RUTA, NOBUS, OPERADOR) VALUES('AER311', '2016-06-30', 'MEX', 518, 914, TRIM('X2-797'))
//------------------------------------------------------------
//------------------------------------------------------------
Fecha : 30/06/2016 17:59 
Error : Duplicate entry 'AER311-2016-06-30' for key 'PRIMARY'
SQL   : INSERT INTO PDV_C_GUIA_PRECAPTURA(ID_CORRIDA, FECHA, DESTINO, ID_RUTA, NOBUS, OPERADOR) VALUES('AER311', '2016-06-30', 'MEX', 518, 914, TRIM('X2-797'))
//------------------------------------------------------------
//------------------------------------------------------------
Fecha : 30/06/2016 18:06 
Error : Duplicate entry 'AER311-2016-06-30' for key 'PRIMARY'
SQL   : INSERT INTO PDV_C_GUIA_PRECAPTURA(ID_CORRIDA, FECHA, DESTINO, ID_RUTA, NOBUS, OPERADOR) VALUES('AER311', '2016-06-30', 'MEX', 518, 914, TRIM('X2-797'))
//------------------------------------------------------------
//------------------------------------------------------------
Fecha : 30/06/2016 18:07 
Error : Duplicate entry 'AER311-2016-06-30' for key 'PRIMARY'
SQL   : INSERT INTO PDV_C_GUIA_PRECAPTURA(ID_CORRIDA, FECHA, DESTINO, ID_RUTA, NOBUS, OPERADOR) VALUES('AER311', '2016-06-30', 'MEX', 518, 914, TRIM('X2-797'))
//------------------------------------------------------------
//------------------------------------------------------------
Fecha : 30/06/2016 18:08 
Error : Duplicate entry 'AER311-2016-06-30' for key 'PRIMARY'
SQL   : INSERT INTO PDV_C_GUIA_PRECAPTURA(ID_CORRIDA, FECHA, DESTINO, ID_RUTA, NOBUS, OPERADOR) VALUES('AER311', '2016-06-30', 'MEX', 518, 914, TRIM('X2-797'))
//------------------------------------------------------------
//------------------------------------------------------------
Fecha : 01/07/2016 11:15 
Error : Duplicate entry 'AER311-2016-07-01' for key 'PRIMARY'
SQL   : INSERT INTO PDV_C_GUIA_PRECAPTURA(ID_CORRIDA, FECHA, DESTINO, ID_RUTA, NOBUS, OPERADOR) VALUES('AER311', '2016-07-01', 'MEX', 518, 915, TRIM('X1-837'))
//------------------------------------------------------------
//------------------------------------------------------------
Fecha : 01/07/2016 11:26 
Error : Duplicate entry 'AER311-2016-07-01' for key 'PRIMARY'
SQL   : INSERT INTO PDV_C_GUIA_PRECAPTURA(ID_CORRIDA, FECHA, DESTINO, ID_RUTA, NOBUS, OPERADOR) VALUES('AER311', '2016-07-01', 'MEX', 518, 915, TRIM('X1-837'))
//------------------------------------------------------------
//------------------------------------------------------------
Fecha : 01/07/2016 11:28 
Error : Duplicate entry 'AER311-2016-07-01' for key 'PRIMARY'
SQL   : INSERT INTO PDV_C_GUIA_PRECAPTURA(ID_CORRIDA, FECHA, DESTINO, ID_RUTA, NOBUS, OPERADOR) VALUES('AER311', '2016-07-01', 'MEX', 518, 915, TRIM('X1-837'))
//------------------------------------------------------------
//------------------------------------------------------------
Fecha : 01/07/2016 11:29 
Error : Duplicate entry 'AER311-2016-07-01' for key 'PRIMARY'
SQL   : INSERT INTO PDV_C_GUIA_PRECAPTURA(ID_CORRIDA, FECHA, DESTINO, ID_RUTA, NOBUS, OPERADOR) VALUES('AER311', '2016-07-01', 'MEX', 518, 915, TRIM('X1-837'))
//------------------------------------------------------------
//------------------------------------------------------------
Fecha : 01/07/2016 11:33 
Error : Duplicate entry 'AER311-2016-07-01' for key 'PRIMARY'
SQL   : INSERT INTO PDV_C_GUIA_PRECAPTURA(ID_CORRIDA, FECHA, DESTINO, ID_RUTA, NOBUS, OPERADOR) VALUES('AER311', '2016-07-01', 'MEX', 518, 915, TRIM('X1-837'))
//------------------------------------------------------------
//------------------------------------------------------------
Fecha : 01/07/2016 11:34 
Error : Duplicate entry 'AER311-2016-07-01' for key 'PRIMARY'
SQL   : INSERT INTO PDV_C_GUIA_PRECAPTURA(ID_CORRIDA, FECHA, DESTINO, ID_RUTA, NOBUS, OPERADOR) VALUES('AER311', '2016-07-01', 'MEX', 518, 915, TRIM('X1-837'))
//------------------------------------------------------------
//------------------------------------------------------------
Fecha : 01/07/2016 11:36 
Error : Duplicate entry 'AER311-2016-07-01' for key 'PRIMARY'
SQL   : INSERT INTO PDV_C_GUIA_PRECAPTURA(ID_CORRIDA, FECHA, DESTINO, ID_RUTA, NOBUS, OPERADOR) VALUES('AER311', '2016-07-01', 'MEX', 518, 915, TRIM('X1-837'))
//------------------------------------------------------------
//------------------------------------------------------------
Fecha : 01/07/2016 11:37 
Error : Duplicate entry 'AER311-2016-07-01' for key 'PRIMARY'
SQL   : INSERT INTO PDV_C_GUIA_PRECAPTURA(ID_CORRIDA, FECHA, DESTINO, ID_RUTA, NOBUS, OPERADOR) VALUES('AER311', '2016-07-01', 'MEX', 518, 915, TRIM('X1-837'))
//------------------------------------------------------------
//------------------------------------------------------------
Fecha : 01/07/2016 11:40 
Error : Duplicate entry 'AER311-2016-07-01' for key 'PRIMARY'
SQL   : INSERT INTO PDV_C_GUIA_PRECAPTURA(ID_CORRIDA, FECHA, DESTINO, ID_RUTA, NOBUS, OPERADOR) VALUES('AER311', '2016-07-01', 'MEX', 518, 915, TRIM('X1-837'))
//------------------------------------------------------------
//------------------------------------------------------------
Fecha : 01/07/2016 11:42 
Error : Duplicate entry 'AER311-2016-07-01' for key 'PRIMARY'
SQL   : INSERT INTO PDV_C_GUIA_PRECAPTURA(ID_CORRIDA, FECHA, DESTINO, ID_RUTA, NOBUS, OPERADOR) VALUES('AER311', '2016-07-01', 'MEX', 518, 915, TRIM('X1-837'))
//------------------------------------------------------------
//------------------------------------------------------------
Fecha : 01/07/2016 11:42 
Error : Duplicate entry 'AER311-2016-07-01' for key 'PRIMARY'
SQL   : INSERT INTO PDV_C_GUIA_PRECAPTURA(ID_CORRIDA, FECHA, DESTINO, ID_RUTA, NOBUS, OPERADOR) VALUES('AER311', '2016-07-01', 'MEX', 518, 915, TRIM('X1-837'))
//------------------------------------------------------------
//------------------------------------------------------------
Fecha : 01/07/2016 11:45 
Error : Duplicate entry 'AER311-2016-07-01' for key 'PRIMARY'
SQL   : INSERT INTO PDV_C_GUIA_PRECAPTURA(ID_CORRIDA, FECHA, DESTINO, ID_RUTA, NOBUS, OPERADOR) VALUES('AER311', '2016-07-01', 'MEX', 518, 915, TRIM('X1-837'))
//------------------------------------------------------------
//------------------------------------------------------------
Fecha : 08/07/2016 17:55 
Error : FPago :PDV_STORE_VENTA_ASIENTO_DELETE
SQL   : Duplicate entry '1-10829-2016-07-20 00:00:00' for key 1
//------------------------------------------------------------
//------------------------------------------------------------
Fecha : 08/07/2016 17:55 
Error : FPago :PDV_STORE_VENTA_ASIENTO_DELETE
SQL   : Duplicate entry '2-10829-2016-07-20 00:00:00' for key 1
//------------------------------------------------------------
//------------------------------------------------------------
Fecha : 11/07/2016 14:45 
Error : FPago :PDV_STORE_VENTA_ASIENTO_DELETE
SQL   : Duplicate entry '1-10829-2016-07-30 00:00:00' for key 1
//------------------------------------------------------------
//------------------------------------------------------------
Fecha : 12/07/2016 09:58 
Error : FPago :PDV_STORE_VENTA_ASIENTO_DELETE
SQL   : Duplicate entry '1-10829-2016-07-30 00:00:00' for key 1
//------------------------------------------------------------
//------------------------------------------------------------
Fecha : 12/07/2016 13:07 
Error : FPago :PDV_STORE_VENTA_ASIENTO_DELETE
SQL   : Duplicate entry '16-10829-2016-07-30 00:00:00' for key 1
//------------------------------------------------------------
//------------------------------------------------------------
Fecha : 13/07/2016 11:59 
Error : UPDATE command denied to user 'venta'@'192.168.2.203' for table 'PDV_C_TAQUILLA'
SQL   : UPDATE PDV_C_TAQUILLA SET VERSION = '2.0997' WHERE ID_TERMINAL = 'CCS' AND  ID_TAQUILLA = '10000' AND IP = '192.168.56.1' 
//------------------------------------------------------------
//------------------------------------------------------------
Fecha : 13/07/2016 12:16 
Error : FPago :PDV_STORE_VENTA_ASIENTO_DELETE
SQL   : Duplicate entry '1-10180-2016-07-30 00:30:00' for key 'PRIMARY'
//------------------------------------------------------------
//------------------------------------------------------------
Fecha : 14/07/2016 09:57 
Error : UPDATE command denied to user 'venta'@'192.168.2.203' for table 'PDV_C_TAQUILLA'
SQL   : UPDATE PDV_C_TAQUILLA SET VERSION = '2.0998' WHERE ID_TERMINAL = 'CUE' AND  ID_TAQUILLA = '1000' AND IP = '192.168.56.1' 
//------------------------------------------------------------
//------------------------------------------------------------
Fecha : 14/07/2016 10:04 
Error : FPago :PDV_STORE_VENTA_ASIENTO_DELETE
SQL   : Duplicate entry '1-10886-2016-07-30 04:50:00' for key 'PRIMARY'
//------------------------------------------------------------
//------------------------------------------------------------
Fecha : 14/07/2016 10:06 
Error : UPDATE command denied to user 'venta'@'192.168.2.203' for table 'PDV_C_TAQUILLA'
SQL   : UPDATE PDV_C_TAQUILLA SET VERSION = '2.0998' WHERE ID_TERMINAL = 'CUE' AND  ID_TAQUILLA = '1000' AND IP = '192.168.56.1' 
//------------------------------------------------------------
//------------------------------------------------------------
Fecha : 14/07/2016 10:07 
Error : FPago :PDV_STORE_VENTA_ASIENTO_DELETE
SQL   : Duplicate entry '2-10886-2016-07-30 04:50:00' for key 'PRIMARY'
//------------------------------------------------------------
//------------------------------------------------------------
Fecha : 20/09/2016 11:53 
Error : FPago :PDV_STORE_VENTA_ASIENTO_DELETE
SQL   : Duplicate entry '1-10829-2016-09-30 00:00:00' for key 1
//------------------------------------------------------------
//------------------------------------------------------------
Fecha : 20/09/2016 17:11 
Error : Lost connection to MySQL server at 'reading authorization packet', system error: 2
SQL   : SELECT DESCRIPCION FROM T_C_TERMINAL WHERE ID_TERMINAL = 'MEX'
//------------------------------------------------------------
//------------------------------------------------------------
Fecha : 21/09/2016 10:37 
Error : Unknown database 'CORP2?D?K('
SQL   : SELECT APAGADO FROM PDV_C_TAQUILLA WHERE ID_TERMINAL = 'MEX' AND ID_TAQUILLA = 1000 AND IP = '192.168.56.1' 
//------------------------------------------------------------
//------------------------------------------------------------
Fecha : 21/09/2016 10:37 
Error : Unknown database 'CORP2?D?K('
SQL   : SELECT TIEMPO_APAGADO FROM PDV_C_TAQUILLA WHERE ID_TERMINAL = 'MEX' AND ID_TAQUILLA = 1000 AND IP = '192.168.56.1'
//------------------------------------------------------------
//------------------------------------------------------------
Fecha : 21/09/2016 10:42 
Error : Can't connect to MySQL server on 'localhost' (10061)
SQL   : SELECT APAGADO FROM PDV_C_TAQUILLA WHERE ID_TERMINAL = '?' AND ID_TAQUILLA =  AND IP = '???þ' 
//------------------------------------------------------------
//------------------------------------------------------------
Fecha : 21/09/2016 10:42 
Error : Can't connect to MySQL server on 'localhost' (10061)
SQL   : SELECT TIEMPO_APAGADO FROM PDV_C_TAQUILLA WHERE ID_TERMINAL = '?' AND ID_TAQUILLA =  AND IP = '???þ'
//------------------------------------------------------------
//------------------------------------------------------------
Fecha : 21/09/2016 16:50 
Error : Duplicate entry '10598-2016-09-21' for key 1
SQL   : INSERT INTO PDV_C_GUIA_PRECAPTURA(ID_CORRIDA, FECHA, DESTINO, ID_RUTA, NOBUS, OPERADOR) VALUES('10598', '2016-09-21', 'BVC', 1678, 91, TRIM('X3-544'))
//------------------------------------------------------------
//------------------------------------------------------------
Fecha : 21/09/2016 17:01 
Error : UPDATE command denied to user 'venta'@'192.168.2.203' for table 'PDV_C_TAQUILLA'
SQL   : UPDATE PDV_C_TAQUILLA SET VERSION = '2.101' WHERE ID_TERMINAL = 'IMS' AND  ID_TAQUILLA = '1000' AND IP = '192.168.56.1' 
//------------------------------------------------------------
//------------------------------------------------------------
Fecha : 21/09/2016 17:05 
Error : UPDATE command denied to user 'venta'@'192.168.2.203' for table 'PDV_C_TAQUILLA'
SQL   : UPDATE PDV_C_TAQUILLA SET VERSION = '2.101' WHERE ID_TERMINAL = 'IMS' AND  ID_TAQUILLA = '1000' AND IP = '192.168.56.1' 
//------------------------------------------------------------
//------------------------------------------------------------
Fecha : 21/09/2016 17:22 
Error : UPDATE command denied to user 'venta'@'192.168.2.203' for table 'PDV_C_TAQUILLA'
SQL   : UPDATE PDV_C_TAQUILLA SET VERSION = '2.101' WHERE ID_TERMINAL = 'IMS' AND  ID_TAQUILLA = '1000' AND IP = '192.168.56.1' 
//------------------------------------------------------------
//------------------------------------------------------------
Fecha : 21/09/2016 17:26 
Error : UPDATE command denied to user 'venta'@'192.168.2.203' for table 'PDV_C_TAQUILLA'
SQL   : UPDATE PDV_C_TAQUILLA SET VERSION = '2.101' WHERE ID_TERMINAL = 'IMS' AND  ID_TAQUILLA = '1000' AND IP = '192.168.56.1' 
//------------------------------------------------------------
//------------------------------------------------------------
Fecha : 21/09/2016 17:29 
Error : UPDATE command denied to user 'venta'@'192.168.2.203' for table 'PDV_C_TAQUILLA'
SQL   : UPDATE PDV_C_TAQUILLA SET VERSION = '2.101' WHERE ID_TERMINAL = 'IMS' AND  ID_TAQUILLA = '1000' AND IP = '192.168.56.1' 
//------------------------------------------------------------
//------------------------------------------------------------
Fecha : 21/09/2016 17:38 
Error : UPDATE command denied to user 'venta'@'192.168.2.203' for table 'PDV_C_TAQUILLA'
SQL   : UPDATE PDV_C_TAQUILLA SET VERSION = '2.101' WHERE ID_TERMINAL = 'IMS' AND  ID_TAQUILLA = '1000' AND IP = '192.168.56.1' 
//------------------------------------------------------------
//------------------------------------------------------------
Fecha : 21/09/2016 17:41 
Error : UPDATE command denied to user 'venta'@'192.168.2.203' for table 'PDV_C_TAQUILLA'
